Age Group,Type,Developmental Indicator,Focus Area,SmartLevel,filename,Area,Sub Area
Later Infancy (6-14 months),indicator,"Holds books, turns pages, looks at the pictures and uses sounds or words","CLLD2.1, Paying attention to print as meaningful",CLLD2.1b,page_27.png,"COMMUNICATION, LANGUAGE AND LITERACY DEVELOPMENT (CLLD)","CLLD2, FOUNDATIONS OF READING"
Later Infancy (6-14 months),indicator,"Recognizes and engages with print and pictures, or braille, in environment (e.g., points to identify a person or object in a book or touches with finger)","CLLD2.1, Paying attention to print as meaningful",CLLD2.1c,page_27.png,"COMMUNICATION, LANGUAGE AND LITERACY DEVELOPMENT (CLLD)","CLLD2, FOUNDATIONS OF READING"
Early Toddler (12-24 months),indicator,"Attributes meanings to some symbols such as a sign, logo or design","CLLD2.1, Paying attention to print as meaningful",CLLD2.1d,page_27.png,"COMMUNICATION, LANGUAGE AND LITERACY DEVELOPMENT (CLLD)","CLLD2, FOUNDATIONS OF READING"
Early Toddler (12-24 months),indicator,"Demonstrates interest in written forms of language, such as print in books or signs on building","CLLD2.1, Paying attention to print as meaningful",CLLD2.1e,page_27.png,"COMMUNICATION, LANGUAGE AND LITERACY DEVELOPMENT (CLLD)","CLLD2, FOUNDATIONS OF READING"
Later Toddler,indicator,"Begins to select books for reading enjoyment and reading related activities, sitting and pretending to read self","CLLD2.1, Paying attention to print as meaningful",CLLD2.1f,page_27.png,"COMMUNICATION, LANGUAGE AND LITERACY DEVELOPMENT (CLLD)","CLLD2, FOUNDATIONS OF READING"
Later Toddler,indicator,Distinguishes print from pictures,"CLLD2.1, Paying attention to print as meaningful",CLLD2.1g,page_27.png,"COMMUNICATION, LANGUAGE AND LITERACY DEVELOPMENT (CLLD)","CLLD2, FOUNDATIONS OF READING"
Early Preschool,indicator,"Demonstrates an understanding of the conventions of print (e.g., directionality of print and text)","CLLD2.1, Paying attention to print as meaningful",CLLD2.1g,page_27.png,"COMMUNICATION, LANGUAGE AND LITERACY DEVELOPMENT (CLLD)","CLLD2, FOUNDATIONS OF READING"
Early Preschool,indicator,Points to and names some letters or characters in their names when asked,"CLLD2.1, Paying attention to print as meaningful",CLLD2.1h,page_27.png,"COMMUNICATION, LANGUAGE AND LITERACY DEVELOPMENT (CLLD)","CLLD2, FOUNDATIONS OF READING"
Later Preschool,indicator,"Distinguishes among a variety of text and understands their function (e.g., books, shopping lists, etc.)","CLLD2.1, Paying attention to print as meaningful",CLLD2.1i,page_27.png,"COMMUNICATION, LANGUAGE AND LITERACY DEVELOPMENT (CLLD)","CLLD2, FOUNDATIONS OF READING"
Later Preschool,indicator,Understands that print communicates the message in stories or other texts,"CLLD2.1, Paying attention to print as meaningful",CLLD2.1h,page_27.png,"COMMUNICATION, LANGUAGE AND LITERACY DEVELOPMENT (CLLD)","CLLD2, FOUNDATIONS OF READING"
Later Preschool,indicator,Begins to track print as storyline is read aloud by pointing or touching,"CLLD2.1, Paying attention to print as meaningful",CLLD2.1j,page_27.png,"COMMUNICATION, LANGUAGE AND LITERACY DEVELOPMENT (CLLD)","CLLD2, FOUNDATIONS OF READING"
Early Infancy (0-8 months),indicator,Begins to grasp writing tools,CLLD3.3. Handling writing tools,CLLD3.3a,page_33.png,"COMMUNICATION, LANGUAGE AND LITERACY DEVELOPMENT (CLLD)",CLLD3. FOUNDATIONS OF WRITING
Later Infancy (6-14 months),indicator,"Uses the whole arm to make marks, drawing, or scribbling; finger positioning may be too high or too close to the tip",CLLD3.3. Handling writing tools,CLLD3.3d,page_33.png,"COMMUNICATION, LANGUAGE AND LITERACY DEVELOPMENT (CLLD)",CLLD3. FOUNDATIONS OF WRITING
Early Toddler (12-24 months),indicator,"Attempts to use the tripod finger grip, but grip may be too tight or too loose",CLLD3.3. Handling writing tools,CLLD3.3e,page_33.png,"COMMUNICATION, LANGUAGE AND LITERACY DEVELOPMENT (CLLD)",CLLD3. FOUNDATIONS OF WRITING
Later Toddler,indicator,"Begins to show increased strength in wrist for mark-making; uses a variety of writing tools (e.g. markers, pens, chalk)",CLLD3.3. Handling writing tools,CLLD3.3f,page_33.png,"COMMUNICATION, LANGUAGE AND LITERACY DEVELOPMENT (CLLD)",CLLD3. FOUNDATIONS OF WRITING
Early Preschool,indicator,Begins to use a more efficient three-finger grip to manipulate writing tools,CLLD3.3. Handling writing tools,CLLD3.3g,page_33.png,"COMMUNICATION, LANGUAGE AND LITERACY DEVELOPMENT (CLLD)",CLLD3. FOUNDATIONS OF WRITING
Early Preschool,indicator,Uses a variety of digital tools,CLLD3.3. Handling writing tools,CLLD3.3h,page_33.png,"COMMUNICATION, LANGUAGE AND LITERACY DEVELOPMENT (CLLD)",CLLD3. FOUNDATIONS OF WRITING
Early Infancy (0-8 months),indicator,"Uses each new position (raising head, rolling onto back, sitting) to explore new ways to explore the environment (e.g., sits up to be able to reach for an object)",HPD2.2. Exploring the environment,HPD223,page_37.png,HEALTH AND PHYSICAL DEVELOPMENT (HPD),"HPD2, GROSS MOTOR"
Later Infancy (6-14 months),indicator,"Uses body position, balance, and movement to explore and examine materials, space, and surroundings (e.g., pulling up to stand and holding onto couch, cruising around tables)",HPD2.2. Exploring the environment,HPD224,page_37.png,HEALTH AND PHYSICAL DEVELOPMENT (HPD),"HPD2, GROSS MOTOR"
Early Toddler (12-24 months),indicator,"Shows enjoyment of active play and engages in regular and sustained movement (e.g., pushes toys around, goes up and down slide over and over, dumps items out of containers)",HPD2.2. Exploring the environment,HPD222,page_37.png,HEALTH AND PHYSICAL DEVELOPMENT (HPD),"HPD2, GROSS MOTOR"
Early Toddler (12-24 months),indicator,Uses a variety of increasingly complex movements and body positions to participate in active and quiet indoor and outdoor play,HPD2.2. Exploring the environment,HPD225,page_37.png,HEALTH AND PHYSICAL DEVELOPMENT (HPD),"HPD2, GROSS MOTOR"
Older Toddler (24-36 months),indicator,"Chooses to participate in simple games and other structured motor activities (indoors and outdoors) that enhance physical fitness, such as songs with movement, throwing and catching balls",HPD2.2. Exploring the environment,HPD226,page_37.png,HEALTH AND PHYSICAL DEVELOPMENT (HPD),"HPD2, GROSS MOTOR"
Older Toddler (24-36 months),indicator,"Develops strength and stamina by spending extended periods of time playing and participating in activities that build strength, speed, flexibility, and coordination (e.g., tag or chase games)",HPD2.2. Exploring the environment,HPD229,page_37.png,HEALTH AND PHYSICAL DEVELOPMENT (HPD),"HPD2, GROSS MOTOR"
Infant,Developmental Indicator,Uses simple behaviors to solve common social problems when interacting with others,SED3.4. Solving social interaction problems,SEDS-i.c,page_22.png,SOCIAL AND EMOTIONAL DEVELOPMENT (SED),SED3. INTERACTING WITH OTHERS
Young Toddler,Developmental Indicator,"Uses simple problem-solving skills to resolve conflicts with other children (e.g., accepts adult suggestion to take turns with toy)",SED3.4. Solving social interaction problems,SEDS-k,page_22.png,SOCIAL AND EMOTIONAL DEVELOPMENT (SED),SED3. INTERACTING WITH OTHERS
Older Toddler,Developmental Indicator,"Uses problem-solving strategies to resolve problems, such as asking for help because something is out of reach, getting an adult to help with a zipper, or using a chair to reach a toy on a shelf",SED3.4. Solving social interaction problems,SEDS-l,page_22.png,SOCIAL AND EMOTIONAL DEVELOPMENT (SED),SED3. INTERACTING WITH OTHERS
Early Preschool,Developmental Indicator,Uses problem-solving skills independently or with adult support to resolve social conflicts,SED3.4. Solving social interaction problems,SEDS-m,page_22.png,SOCIAL AND EMOTIONAL DEVELOPMENT (SED),SED3. INTERACTING WITH OTHERS
Early Infancy (0-8 months),indicator,"Explores new body positions and movements, such as rolling over",HPD2.1. Developing large muscle control,HPD2.1a,page_36.png,HEALTH AND PHYSICAL DEVELOPMENT (HPD),"HPD2, GROSS MOTOR"
Early Infancy (0-8 months),indicator,"Moves around in their environment by pulling to stand, scooting, and crawling",HPD2.1. Developing large muscle control,HPD2.1b,page_36.png,HEALTH AND PHYSICAL DEVELOPMENT (HPD),"HPD2, GROSS MOTOR"
Later Infancy (6-14 months),indicator,"Moves from crawling to standing to cruising to walking, learning new ways to move from one place to another",HPD2.1. Developing large muscle control,HPD2.1c,page_36.png,HEALTH AND PHYSICAL DEVELOPMENT (HPD),"HPD2, GROSS MOTOR"
Later Infancy (6-14 months),indicator,Practices new skills by repeating movements,HPD2.1. Developing large muscle control,HPD2.1d,page_36.png,HEALTH AND PHYSICAL DEVELOPMENT (HPD),"HPD2, GROSS MOTOR"
Early Toddler (12-24 months),indicator,Moves through the world with more independence,HPD2.1. Developing large muscle control,HPD2.1e,page_36.png,HEALTH AND PHYSICAL DEVELOPMENT (HPD),"HPD2, GROSS MOTOR"
Early Toddler (12-24 months),indicator,Carries objects while walking,HPD2.1. Developing large muscle control,HPD2.1f,page_36.png,HEALTH AND PHYSICAL DEVELOPMENT (HPD),"HPD2, GROSS MOTOR"
Early Toddler (12-24 months),indicator,Climbs on a chair to reach something,HPD2.1. Developing large muscle control,HPD2.1g,page_36.png,HEALTH AND PHYSICAL DEVELOPMENT (HPD),"HPD2, GROSS MOTOR"
Early Preschool (24-36 months),indicator,Gains control of a variety of movements,HPD2.1. Developing large muscle control,HPD2.1h,page_36.png,HEALTH AND PHYSICAL DEVELOPMENT (HPD),"HPD2, GROSS MOTOR"
Early Preschool (24-36 months),indicator,Understands that physical activity is important and identifies activities they enjoy doing with their family,HPD2.1. Developing large muscle control,HPD2.1i,page_36.png,HEALTH AND PHYSICAL DEVELOPMENT (HPD),"HPD2, GROSS MOTOR"
Early Preschool (24-36 months),indicator,"Performs actions smoothly with balance, strength, and coordination",HPD2.1. Developing large muscle control,HPD2.1j,page_36.png,HEALTH AND PHYSICAL DEVELOPMENT (HPD),"HPD2, GROSS MOTOR"
Early Preschool (24-36 months),indicator,Uses a variety of toys and equipment that enhance gross motor skill and coordination,HPD2.1. Developing large muscle control,HPD2.1k,page_36.png,HEALTH AND PHYSICAL DEVELOPMENT (HPD),"HPD2, GROSS MOTOR"
Late Preschool (36-48 months),indicator,Uses both hands to manipulate objects,HPD2.1. Developing large muscle control,HPD2.1l,page_36.png,HEALTH AND PHYSICAL DEVELOPMENT (HPD),"HPD2, GROSS MOTOR"
Late Preschool (36-48 months),indicator,"Carries out activities that combine and coordinate large muscle movements, including swinging on a swing set, climbing a ladder, or pedaling a tricycle",HPD2.1. Developing large muscle control,HPD2.1m,page_36.png,HEALTH AND PHYSICAL DEVELOPMENT (HPD),"HPD2, GROSS MOTOR"
Kindergarten (48-60 months),indicator,"Demonstrates more coordinated movement when jumping for height and distance, hopping, and running",HPD2.1. Developing large muscle control,HPD2.1n,page_36.png,HEALTH AND PHYSICAL DEVELOPMENT (HPD),"HPD2, GROSS MOTOR"
Kindergarten (48-60 months),indicator,Shows awareness of own body in relation to other people and objects while moving through space,HPD2.1. Developing large muscle control,HPD2.1o,page_36.png,HEALTH AND PHYSICAL DEVELOPMENT (HPD),"HPD2, GROSS MOTOR"
Kindergarten (48-60 months),indicator,Able to balance on one leg for longer periods of time,HPD2.1. Developing large muscle control,HPD2.1p,page_36.png,HEALTH AND PHYSICAL DEVELOPMENT (HPD),"HPD2, GROSS MOTOR"
Kindergarten (48-60 months),indicator,Hops and gallops with skill and control at varying speeds and in different directions,HPD2.1. Developing large muscle control,HPD2.1q,page_36.png,HEALTH AND PHYSICAL DEVELOPMENT (HPD),"HPD2, GROSS MOTOR"
Early Infancy (0-8 months),indicator,"Notices peer by looking, touching, or making sounds directed toward the child while lying on blanket close to them",SED3.2. Developing relationships with other children,SED3.2a,page_20.png,SOCIAL AND EMOTIONAL DEVELOPMENT (SED),SED3. INTERACTING WITH OTHERS
Later Infancy (6-14 months),indicator,"Recognizes familiar others by making sounds, facial expressions, or behavior (e.g. reaches up arms, or touches other's face)",SED3.2. Developing relationships with other children,SED3.2b,page_20.png,SOCIAL AND EMOTIONAL DEVELOPMENT (SED),SED3. INTERACTING WITH OTHERS
Later Infancy (6-14 months),indicator,Shows interest in peers who are playing nearby and interacts with them briefly,SED3.2. Developing relationships with other children,SED3.2c,page_20.png,SOCIAL AND EMOTIONAL DEVELOPMENT (SED),SED3. INTERACTING WITH OTHERS
Later Infancy (6-14 months),indicator,Interacts with a familiar child in simple back-and-forth exchanges (e.g. makes silly sounds),SED3.2. Developing relationships with other children,SED3.2d,page_20.png,SOCIAL AND EMOTIONAL DEVELOPMENT (SED),SED3. INTERACTING WITH OTHERS
Toddler (12-24 months),indicator,Participates in simple back-and-forth interactions with another child,SED3.2. Developing relationships with other children,SED3.2e,page_20.png,SOCIAL AND EMOTIONAL DEVELOPMENT (SED),SED3. INTERACTING WITH OTHERS
Toddler (12-24 months),indicator,"Interacts with a few children on a regular basis; knows some of their names, knows their likes or dislikes",SED3.2. Developing relationships with other children,SED3.2f,page_20.png,SOCIAL AND EMOTIONAL DEVELOPMENT (SED),SED3. INTERACTING WITH OTHERS
Toddler (12-24 months),indicator,Plays near with a few children on similar activities (e.g. runs after a child or pays attention to other children),SED3.2. Developing relationships with other children,SED3.2g,page_20.png,SOCIAL AND EMOTIONAL DEVELOPMENT (SED),SED3. INTERACTING WITH OTHERS
Toddler (12-24 months),indicator,Enjoys playful interactions and social exchange games,SED3.2. Developing relationships with other children,SED3.2h,page_20.png,SOCIAL AND EMOTIONAL DEVELOPMENT (SED),SED3. INTERACTING WITH OTHERS
Two Year Old (24-36 months),indicator,Plays alongside peers and engages in simple turn-taking (e.g. takes turns on the slide at the playground),SED3.2. Developing relationships with other children,SED3.2i,page_20.png,SOCIAL AND EMOTIONAL DEVELOPMENT (SED),SED3. INTERACTING WITH OTHERS
Two Year Old (24-36 months),indicator,"Interacts with a few children on shared activities and understands simple social interaction rules (e.g.""your turn"" or ""my turn"")",SED3.2. Developing relationships with other children,SED3.2j,page_20.png,SOCIAL AND EMOTIONAL DEVELOPMENT (SED),SED3. INTERACTING WITH OTHERS
Two Year Old (24-36 months),indicator,Begins to initiate interactions with other children in shared play activities,SED3.2. Developing relationships with other children,SED3.2k,page_20.png,SOCIAL AND EMOTIONAL DEVELOPMENT (SED),SED3. INTERACTING WITH OTHERS
Three Year Old to Four Year Old (36 months to end of preschool),indicator,Builds social relationships and becomes more connected to other children (e.g. has a favorite friend at library story time),SED3.2. Developing relationships with other children,SED3.2l,page_20.png,SOCIAL AND EMOTIONAL DEVELOPMENT (SED),SED3. INTERACTING WITH OTHERS
Three Year Old to Four Year Old (36 months to end of preschool),indicator,"Shows preference for particular playmates, such as greeting friends by name",SED3.2. Developing relationships with other children,SED3.2m,page_20.png,SOCIAL AND EMOTIONAL DEVELOPMENT (SED),SED3. INTERACTING WITH OTHERS
Three Year Old to Four Year Old (36 months to end of preschool),indicator,Makes friends and is able to name friends when asked by an adult or others,SED3.2. Developing relationships with other children,SED3.2n,page_20.png,SOCIAL AND EMOTIONAL DEVELOPMENT (SED),SED3. INTERACTING WITH OTHERS
Three Year Old to Four Year Old (36 months to end of preschool),indicator,Expresses interest in participating in a group activity by initiating or responding,SED3.2. Developing relationships with other children,SED3.2o,page_20.png,SOCIAL AND EMOTIONAL DEVELOPMENT (SED),SED3. INTERACTING WITH OTHERS
Three Year Old to Four Year Old (36 months to end of preschool),indicator,Engages in shared activities or play with shared toys or materials,SED3.2. Developing relationships with other children,SED3.2p,page_20.png,SOCIAL AND EMOTIONAL DEVELOPMENT (SED),SED3. INTERACTING WITH OTHERS
Three Year Old to Four Year Old (36 months to end of preschool),indicator,Increases interest in spending time with peers and is able to maintain special friendships over time,SED3.2. Developing relationships with other children,SED3.2q,page_20.png,SOCIAL AND EMOTIONAL DEVELOPMENT (SED),SED3. INTERACTING WITH OTHERS
Three Year Old to Four Year Old (36 months to end of preschool),indicator,Responds to the needs of others with simple helpful actions,SED3.2. Developing relationships with other children,SED3.2r,page_20.png,SOCIAL AND EMOTIONAL DEVELOPMENT (SED),SED3. INTERACTING WITH OTHERS
Three Year Old to Four Year Old (36 months to end of preschool),indicator,Responds to others' questions in social interactions with words or actions,SED3.2. Developing relationships with other children,SED3.2s,page_20.png,SOCIAL AND EMOTIONAL DEVELOPMENT (SED),SED3. INTERACTING WITH OTHERS
Three Year Old to Four Year Old (36 months to end of preschool),indicator,"Plays with peers in a coordinated manner around a shared theme and with shared goals, materials and actions (e.g. dramatic play scene)",SED3.2. Developing relationships with other children,SED3.2t,page_20.png,SOCIAL AND EMOTIONAL DEVELOPMENT (SED),SED3. INTERACTING WITH OTHERS
Early Infancy (0-8 months),indicator,Uses senses to explore immediate environment,HDI. Learning through all senses,HPD1.E1,page_35.png,AREA FOUR: HEALTH AND PHYSICAL DEVELOPMENT (HPD),HPD1. USING SENSES
Early Infancy (0-8 months),indicator,"Turns head toward sounds, touches, sights, or smells",HDI. Learning through all senses,HPD1.E2,page_35.png,AREA FOUR: HEALTH AND PHYSICAL DEVELOPMENT (HPD),HPD1. USING SENSES
Early Infancy (0-8 months),indicator,Shows preference for specific toys and objects to play with,HDI. Learning through all senses,HPD1.E3,page_35.png,AREA FOUR: HEALTH AND PHYSICAL DEVELOPMENT (HPD),HPD1. USING SENSES
Later Infancy (6-14 months),indicator,"Understands properties of objects in matching, discrimination, and exploration (mouthing objects)",HDI. Learning through all senses,HPD1.L1,page_35.png,AREA FOUR: HEALTH AND PHYSICAL DEVELOPMENT (HPD),HPD1. USING SENSES
Later Infancy (6-14 months),indicator,"Combines information gained from the senses (e.g., uses sight, touch and hearing in coordination to reach for a toy)",HDI. Learning through all senses,HPD1.L2,page_35.png,AREA FOUR: HEALTH AND PHYSICAL DEVELOPMENT (HPD),HPD1. USING SENSES
Early Toddler (12-24 months),indicator,"Demonstrates sensory preferences (e.g., chooses a favorite scent or texture)",HDI. Learning through all senses,HPD1.T1,page_35.png,AREA FOUR: HEALTH AND PHYSICAL DEVELOPMENT (HPD),HPD1. USING SENSES
Early Toddler (12-24 months),indicator,"Uses the information received from his senses to change the way he interacts with the environment (e.g., changes volume of voice based on noise level in the environment such as being louder to be heard when in a large group setting)",HDI. Learning through all senses,HPD1.T2,page_35.png,AREA FOUR: HEALTH AND PHYSICAL DEVELOPMENT (HPD),HPD1. USING SENSES
Early Infancy (0-8 months),indicator,Participates in solitary play when exploring toys and objects in own environment,SED3.3. Engaging in cooperative play,SED3.3a,page_21.png,SOCIAL AND EMOTIONAL DEVELOPMENT (SED),SED3. INTERACTING WITH OTHERS
Early Infancy (0-8 months),indicator,Engages in solitary play when exploring toys and objects in indoor and outdoor settings,SED3.3. Engaging in cooperative play,SED3.3b,page_21.png,SOCIAL AND EMOTIONAL DEVELOPMENT (SED),SED3. INTERACTING WITH OTHERS
Early Infancy (0-8 months),indicator,Plays social games like peek-a-boo with familiar adult,SED3.3. Engaging in cooperative play,SED3.3c,page_21.png,SOCIAL AND EMOTIONAL DEVELOPMENT (SED),SED3. INTERACTING WITH OTHERS
Later Infancy (6-14 months),indicator,Plays watching other children who are playing nearby but not directly interacting with them,SED3.3. Engaging in cooperative play,SED3.3d,page_21.png,SOCIAL AND EMOTIONAL DEVELOPMENT (SED),SED3. INTERACTING WITH OTHERS
Later Infancy (6-14 months),indicator,"Imitates other people's actions (e.g. claps hands together, covers eyes with hands)",SED3.3. Engaging in cooperative play,SED3.3e,page_21.png,SOCIAL AND EMOTIONAL DEVELOPMENT (SED),SED3. INTERACTING WITH OTHERS
Early Toddler (12-24 months),indicator,"Plays near one or two other children, often using the same materials or actions",SED3.3. Engaging in cooperative play,SED3.3f,page_21.png,SOCIAL AND EMOTIONAL DEVELOPMENT (SED),SED3. INTERACTING WITH OTHERS
Early Toddler (12-24 months),indicator,"Engages in simple imitation (e.g. pouring sand, stacking blocks)",SED3.3. Engaging in cooperative play,SED3.3g,page_21.png,SOCIAL AND EMOTIONAL DEVELOPMENT (SED),SED3. INTERACTING WITH OTHERS
Early Toddler (12-24 months),indicator,"Plays simple games with familiar adult (e.g. Simon Says, Hokey-Pokey, Follow the Leader)",SED3.3. Engaging in cooperative play,SED3.3h,page_21.png,SOCIAL AND EMOTIONAL DEVELOPMENT (SED),SED3. INTERACTING WITH OTHERS
Later Toddler (22-36 months),indicator,Briefly engages in parallel play with other children using similar materials,SED3.3. Engaging in cooperative play,SED3.3i,page_21.png,SOCIAL AND EMOTIONAL DEVELOPMENT (SED),SED3. INTERACTING WITH OTHERS
Later Toddler (22-36 months),indicator,"Engages in simple play with other children, including chasing games and dramatic play",SED3.3. Engaging in cooperative play,SED3.3j,page_21.png,SOCIAL AND EMOTIONAL DEVELOPMENT (SED),SED3. INTERACTING WITH OTHERS
Early Preschool (34-48 months),indicator,Participates in loosely structured group games (e.g. playing in the sand box),SED3.3. Engaging in cooperative play,SED3.3k,page_21.png,SOCIAL AND EMOTIONAL DEVELOPMENT (SED),SED3. INTERACTING WITH OTHERS
Early Preschool (34-48 months),indicator,"Engages in cooperative play, communication, and role taking with each other to maintain play",SED3.3. Engaging in cooperative play,SED3.3l,page_21.png,SOCIAL AND EMOTIONAL DEVELOPMENT (SED),SED3. INTERACTING WITH OTHERS
Later Preschool (44-60 months),indicator,"Engages in cooperative play, using increasing memory ability to expand play themes",SED3.3. Engaging in cooperative play,SED3.3m,page_21.png,SOCIAL AND EMOTIONAL DEVELOPMENT (SED),SED3. INTERACTING WITH OTHERS
Later Preschool (44-60 months),indicator,Participates in complex cooperative pretend play with roles and multiple themes,SED3.3. Engaging in cooperative play,SED3.3n,page_21.png,SOCIAL AND EMOTIONAL DEVELOPMENT (SED),SED3. INTERACTING WITH OTHERS
Early Infancy (0-8 months),indicator,Coordinates hands ana eyes when reaching Farad holding items,HPD3.1. Using eyes and hands together,HPDS.13,page_38.png,HEALTH AND PHYSICAL DEVELOPMENT (HPD),"PDS, FINEMOTOR"
Later Infancy (6-14 months),indicator,"Uses both hands 0 swipe at. seach fr, prasp, hol, shake, eelease 'objec and begins co tester abject from hand eo hand",HPD3.1. Using eyes and hands together,HPDS.18,page_38.png,HEALTH AND PHYSICAL DEVELOPMENT (HPD),"PDS, FINEMOTOR"
Later Infancy (6-14 months),indicator,Performs more complex actions such a tratsfersing objects fiom 'one hand tothe other anal dropping them ino a fonainer,HPD3.1. Using eyes and hands together,HDS,page_38.png,HEALTH AND PHYSICAL DEVELOPMENT (HPD),"PDS, FINEMOTOR"
Early Toddler (12-24 months),indicator,Plays with objects Uses took chat require | Plays with smaller such a putting together | finger and hand control | object with increasing anduakingapar toys,HPD3.1. Using eyes and hands together,Hpps.d,page_38.png,HEALTH AND PHYSICAL DEVELOPMENT (HPD),"PDS, FINEMOTOR"
Early Toddler (12-24 months),indicator,"Us simpleton eg, | <atngutensls butoning | othe)",HPD3.1. Using eyes and hands together,HPDS.19 irl,page_38.png,HEALTH AND PHYSICAL DEVELOPMENT (HPD),"PDS, FINEMOTOR"
Older Toddler (22-36 months),indicator,"Uses tol thar require surengh, contol, and skills of small musces",HPD3.1. Using eyes and hands together,aeps.i,page_38.png,HEALTH AND PHYSICAL DEVELOPMENT (HPD),"PDS, FINEMOTOR"
Older Toddler (22-36 months),indicator,"'Uses objects with ease (eg. fork spoon, and sometimes able kai)",HPD3.1. Using eyes and hands together,apps,page_38.png,HEALTH AND PHYSICAL DEVELOPMENT (HPD),"PDS, FINEMOTOR"
Older Toddler (22-36 months),indicator,aws smaller igures and includes more detail (eg faces with fears),HPD3.1. Using eyes and hands together,HbDs1k,page_38.png,HEALTH AND PHYSICAL DEVELOPMENT (HPD),"PDS, FINEMOTOR"
Early Infancy (0-8 months),indicator,Learns about self by exploring hands and feet (e.g. looks at hands),SED1.1. Developing self-awareness,SE1.1a,page_11.png,SOCIAL AND EMOTIONAL DEVELOPMENT (SED),SED1. POSITIVE SELF-CONCEPT
Early Infancy (0-8 months),indicator,Turns to familiar voice,SED1.1. Developing self-awareness,SE1.1b,page_11.png,SOCIAL AND EMOTIONAL DEVELOPMENT (SED),SED1. POSITIVE SELF-CONCEPT
Early Infancy (0-8 months),indicator,"Displays distinct facial expressions (e.g. interest, enjoyment, disgust, distress)",SED1.1. Developing self-awareness,SE1.1c,page_11.png,SOCIAL AND EMOTIONAL DEVELOPMENT (SED),SED1. POSITIVE SELF-CONCEPT
Later Infancy (6-14 months),indicator,Recognizes own name (e.g. turns or smiles when name is heard),SED1.1. Developing self-awareness,SE1.1d,page_11.png,SOCIAL AND EMOTIONAL DEVELOPMENT (SED),SED1. POSITIVE SELF-CONCEPT
Later Infancy (6-14 months),indicator,Discovers own body (e.g. examines hands; finds nose; points to eyes when asked),SED1.1. Developing self-awareness,SE1.1e,page_11.png,SOCIAL AND EMOTIONAL DEVELOPMENT (SED),SED1. POSITIVE SELF-CONCEPT
