Age Group,Type,Developmental Indicator,Focus Area,SmartLevel,filename,Area,Sub Area
Early Infancy (0-8 months),(CLLD3.1a),"Makes scribbles or distinct marks like swoops, circles, and waves to represent their ideas","CLLD3.1. Drawing, scribbling, and writing to communicate",None,page_31.png,"COMMUNICATION, LANGUAGE AND LITERACY DEVELOPMENT (CLLD)","CLLD3, FOUNDATIONS OF WRITING"
Later Infancy (6-14 months),(CLLD3.1b),Uses writing utensils to makes distinct marks,"CLLD3.1. Drawing, scribbling, and writing to communicate",None,page_31.png,"COMMUNICATION, LANGUAGE AND LITERACY DEVELOPMENT (CLLD)","CLLD3, FOUNDATIONS OF WRITING"
Later Infancy (6-14 months),(CLLD3.1c),Writes in a linear fashion and connects marks with repetitive up/down or looping motions,"CLLD3.1. Drawing, scribbling, and writing to communicate",None,page_31.png,"COMMUNICATION, LANGUAGE AND LITERACY DEVELOPMENT (CLLD)","CLLD3, FOUNDATIONS OF WRITING"
Early Toddler (12-24 months),(CLLD3.1d),Begins to use scribbles or intentional marks to represent objects,"CLLD3.1. Drawing, scribbling, and writing to communicate",None,page_31.png,"COMMUNICATION, LANGUAGE AND LITERACY DEVELOPMENT (CLLD)","CLLD3, FOUNDATIONS OF WRITING"
Early Toddler (12-24 months),(CLLD3.1e),"Attempts to ""read"" their writing or drawing to others, including their name","CLLD3.1. Drawing, scribbling, and writing to communicate",None,page_31.png,"COMMUNICATION, LANGUAGE AND LITERACY DEVELOPMENT (CLLD)","CLLD3, FOUNDATIONS OF WRITING"
Early Preschool (24-36 months),(CLLD3.1f),"Begins to use distinct, letter-like symbols and letter formations with curves, lines, circles, and dots to represent words, ideas, phrases, sentences, and stories or events with or without drawing","CLLD3.1. Drawing, scribbling, and writing to communicate",None,page_31.png,"COMMUNICATION, LANGUAGE AND LITERACY DEVELOPMENT (CLLD)","CLLD3, FOUNDATIONS OF WRITING"
Early Preschool (24-36 months),(CLLD3.1g),Begins to draw/write for a variety of audiences (e.g. family members and teachers),"CLLD3.1. Drawing, scribbling, and writing to communicate",None,page_31.png,"COMMUNICATION, LANGUAGE AND LITERACY DEVELOPMENT (CLLD)","CLLD3, FOUNDATIONS OF WRITING"
Early Preschool (24-36 months),(CLLD3.1h),"Begins to draw/write for a variety of purposes (e.g. grocery list, invitations, birthday card)","CLLD3.1. Drawing, scribbling, and writing to communicate",None,page_31.png,"COMMUNICATION, LANGUAGE AND LITERACY DEVELOPMENT (CLLD)","CLLD3, FOUNDATIONS OF WRITING"
Early Preschool (24-36 months),(CLLD3.1i),"Begins to use letter strings or a group of letters to represent words, ideas, phrases, sentences, and stories or events","CLLD3.1. Drawing, scribbling, and writing to communicate",None,page_31.png,"COMMUNICATION, LANGUAGE AND LITERACY DEVELOPMENT (CLLD)","CLLD3, FOUNDATIONS OF WRITING"
Later Preschool (36-48 months),(CLLD3.1j),"Begins to attend to the spacing of their writing (e.g., attempts to copy a sign or poster in school)","CLLD3.1. Drawing, scribbling, and writing to communicate",None,page_31.png,"COMMUNICATION, LANGUAGE AND LITERACY DEVELOPMENT (CLLD)","CLLD3, FOUNDATIONS OF WRITING"
Later Preschool (36-48 months),(CLLD3.1k),Begins to copy or write letters or numbers,"CLLD3.1. Drawing, scribbling, and writing to communicate",None,page_31.png,"COMMUNICATION, LANGUAGE AND LITERACY DEVELOPMENT (CLLD)","CLLD3, FOUNDATIONS OF WRITING"
Later Preschool (36-48 months),(CLLD3.1l),Begins to represent all letters in their name,"CLLD3.1. Drawing, scribbling, and writing to communicate",None,page_31.png,"COMMUNICATION, LANGUAGE AND LITERACY DEVELOPMENT (CLLD)","CLLD3, FOUNDATIONS OF WRITING"
Later Preschool (36-48 months),(CLLD3.1m),Begins to recognize name as separate from other pictures or writing produced,"CLLD3.1. Drawing, scribbling, and writing to communicate",None,page_31.png,"COMMUNICATION, LANGUAGE AND LITERACY DEVELOPMENT (CLLD)","CLLD3, FOUNDATIONS OF WRITING"
Later Preschool (36-48 months),(CLLD3.1n),Begins to distinguish print from images or illustrations,"CLLD3.1. Drawing, scribbling, and writing to communicate",None,page_31.png,"COMMUNICATION, LANGUAGE AND LITERACY DEVELOPMENT (CLLD)","CLLD3, FOUNDATIONS OF WRITING"
Later Preschool (36-48 months),(CLLD3.1o),Begins to use initial letter sounds to represent a whole word (e.g. f for fish),"CLLD3.1. Drawing, scribbling, and writing to communicate",None,page_31.png,"COMMUNICATION, LANGUAGE AND LITERACY DEVELOPMENT (CLLD)","CLLD3, FOUNDATIONS OF WRITING"
Later Preschool (36-48 months),(CLLD3.1p),Begins to represent the initial and final sound to represent a word (e.g. d...g for dog),"CLLD3.1. Drawing, scribbling, and writing to communicate",None,page_31.png,"COMMUNICATION, LANGUAGE AND LITERACY DEVELOPMENT (CLLD)","CLLD3, FOUNDATIONS OF WRITING"
Later Preschool (36-48 months),(CLLD3.1q),Retells or reads their writing to others,"CLLD3.1. Drawing, scribbling, and writing to communicate",None,page_31.png,"COMMUNICATION, LANGUAGE AND LITERACY DEVELOPMENT (CLLD)","CLLD3, FOUNDATIONS OF WRITING"
Later Preschool (36-48 months),(CLLD3.1r),"Represents all letters in their own name, with sequencing, positioning, and reversals still evidenced","CLLD3.1. Drawing, scribbling, and writing to communicate",None,page_31.png,"COMMUNICATION, LANGUAGE AND LITERACY DEVELOPMENT (CLLD)","CLLD3, FOUNDATIONS OF WRITING"
Early Primary (48-60 months),(CLLD3.1s),"Begins to produce a correct representation of their name using capital letters, lowercase letters, or a combination of both moving from left to right","CLLD3.1. Drawing, scribbling, and writing to communicate",None,page_31.png,"COMMUNICATION, LANGUAGE AND LITERACY DEVELOPMENT (CLLD)","CLLD3, FOUNDATIONS OF WRITING"
Early Primary (48-60 months),(CLLD3.1t),Begins to copy names of familiar people and objects,"CLLD3.1. Drawing, scribbling, and writing to communicate",None,page_31.png,"COMMUNICATION, LANGUAGE AND LITERACY DEVELOPMENT (CLLD)","CLLD3, FOUNDATIONS OF WRITING"
Early Infancy 0-8 months,indicator,"Begin to recognize frequently seen letters (e.g., letters in own name)",CLLD2.4. Learning how letters and print work to create words and meaning,CLLD2.4a,page_30.png,"COMMUNICATION, LANGUAGE AND LITERACY DEVELOPMENT (CLLD)","CLLD2, FOUNDATIONS OF READING"
Later Infancy 6-14 months,indicator,"Begins to recognize frequently seen letters (e.g., letters in own name)",CLLD2.4. Learning how letters and print work to create words and meaning,CLLD2.4b,page_30.png,"COMMUNICATION, LANGUAGE AND LITERACY DEVELOPMENT (CLLD)","CLLD2, FOUNDATIONS OF READING"
Early Toddler 12-24 months,indicator,Recognizes sounds and recognizes letters associated with beginning of first name and last name,CLLD2.4. Learning how letters and print work to create words and meaning,CLLD2.4c,page_30.png,"COMMUNICATION, LANGUAGE AND LITERACY DEVELOPMENT (CLLD)","CLLD2, FOUNDATIONS OF READING"
Early Preschool 24-36 months,indicator,"Begins to connect Alphabet letter and corresponding sounds (e.g., connecting names and sounds of common letter/words)",CLLD2.4. Learning how letters and print work to create words and meaning,CLLD2.4d,page_30.png,"COMMUNICATION, LANGUAGE AND LITERACY DEVELOPMENT (CLLD)","CLLD2, FOUNDATIONS OF READING"
Preschool 36-48 months,indicator,Can often write first name from memory,CLLD2.4. Learning how letters and print work to create words and meaning,CLLD2.4e,page_30.png,"COMMUNICATION, LANGUAGE AND LITERACY DEVELOPMENT (CLLD)","CLLD2, FOUNDATIONS OF READING"
Preschool 36-48 months,indicator,"For many, with instructional support, matches the sound with the corresponding letter",CLLD2.4. Learning how letters and print work to create words and meaning,CLLD2.4f,page_30.png,"COMMUNICATION, LANGUAGE AND LITERACY DEVELOPMENT (CLLD)","CLLD2, FOUNDATIONS OF READING"
Pre-K 48-60 months,indicator,"For many, with instructional support, matches the letter with the corresponding sound",CLLD2.4. Learning how letters and print work to create words and meaning,CLLD2.4g,page_30.png,"COMMUNICATION, LANGUAGE AND LITERACY DEVELOPMENT (CLLD)","CLLD2, FOUNDATIONS OF READING"
Pre-K 48-60 months,indicator,Recognizes many upper and lowercase letters,CLLD2.4. Learning how letters and print work to create words and meaning,CLLD2.4h,page_30.png,"COMMUNICATION, LANGUAGE AND LITERACY DEVELOPMENT (CLLD)","CLLD2, FOUNDATIONS OF READING"
Pre-K 48-60 months,indicator,Will use a combination of letters and symbols to represent words,CLLD2.4. Learning how letters and print work to create words and meaning,CLLD2.4i,page_30.png,"COMMUNICATION, LANGUAGE AND LITERACY DEVELOPMENT (CLLD)","CLLD2, FOUNDATIONS OF READING"
Early Infancy (0-8 months),indicator,Responds to speaker by turning head or shifting eye gaze,CLLD1.1. Understanding verbal and nonverbal cues,CLLDL1a,page_24.png,"COMMUNICATION, LANGUAGE AND LITERACY DEVELOPMENT (CLLD)",CLLD1. COMMUNICATION
Early Infancy (0-8 months),indicator,Responds to tone of voice changes,CLLD1.1. Understanding verbal and nonverbal cues,CLLDL1b,page_24.png,"COMMUNICATION, LANGUAGE AND LITERACY DEVELOPMENT (CLLD)",CLLD1. COMMUNICATION
Early Infancy (0-8 months),indicator,Directs attention to sounds or object pointed to,CLLD1.1. Understanding verbal and nonverbal cues,CLLDL1c,page_24.png,"COMMUNICATION, LANGUAGE AND LITERACY DEVELOPMENT (CLLD)",CLLD1. COMMUNICATION
Early Infancy (0-8 months),indicator,Responds by looking when name is called,CLLD1.1. Understanding verbal and nonverbal cues,CLLDL1d,page_24.png,"COMMUNICATION, LANGUAGE AND LITERACY DEVELOPMENT (CLLD)",CLLD1. COMMUNICATION
Later Infancy (6-14 months),indicator,Follows simple requests paired with gestures,CLLD1.1. Understanding verbal and nonverbal cues,CLLDL1e,page_24.png,"COMMUNICATION, LANGUAGE AND LITERACY DEVELOPMENT (CLLD)",CLLD1. COMMUNICATION
Later Infancy (6-14 months),indicator,Begins to respond through sounds/gestures to other's questions,CLLD1.1. Understanding verbal and nonverbal cues,CLLDL1f,page_24.png,"COMMUNICATION, LANGUAGE AND LITERACY DEVELOPMENT (CLLD)",CLLD1. COMMUNICATION
Later Infancy (6-14 months),indicator,Makes different sounds to get attention,CLLD1.1. Understanding verbal and nonverbal cues,CLLDL1g,page_24.png,"COMMUNICATION, LANGUAGE AND LITERACY DEVELOPMENT (CLLD)",CLLD1. COMMUNICATION
Later Infancy (6-14 months),indicator,Understands and responds to simple commands and gestures (e.g. shared eye gaze/contact may be influenced by cultural expectations),CLLD1.1. Understanding verbal and nonverbal cues,CLLDL1h,page_24.png,"COMMUNICATION, LANGUAGE AND LITERACY DEVELOPMENT (CLLD)",CLLD1. COMMUNICATION
Later Infancy (6-14 months),indicator,Recognizes common objects when named (e.g. cup),CLLD1.1. Understanding verbal and nonverbal cues,CLLDL1i,page_24.png,"COMMUNICATION, LANGUAGE AND LITERACY DEVELOPMENT (CLLD)",CLLD1. COMMUNICATION
Later Infancy (6-14 months),indicator,Begins to show understanding of approximately 50 words,CLLD1.1. Understanding verbal and nonverbal cues,CLLDL1j,page_24.png,"COMMUNICATION, LANGUAGE AND LITERACY DEVELOPMENT (CLLD)",CLLD1. COMMUNICATION
Early Toddler (12-24 months),indicator,Uses sounds or nonverbal cues to respond to book reading,CLLD1.1. Understanding verbal and nonverbal cues,CLLDL1k,page_24.png,"COMMUNICATION, LANGUAGE AND LITERACY DEVELOPMENT (CLLD)",CLLD1. COMMUNICATION
Early Toddler (12-24 months),indicator,Responds to simple requests,CLLD1.1. Understanding verbal and nonverbal cues,CLLDL1l,page_24.png,"COMMUNICATION, LANGUAGE AND LITERACY DEVELOPMENT (CLLD)",CLLD1. COMMUNICATION
Early Toddler (12-24 months),indicator,"Identifies familiar people, animals, and objects",CLLD1.1. Understanding verbal and nonverbal cues,CLLDL1m,page_24.png,"COMMUNICATION, LANGUAGE AND LITERACY DEVELOPMENT (CLLD)",CLLD1. COMMUNICATION
Early Toddler (12-24 months),indicator,Begins to understand nouns,CLLD1.1. Understanding verbal and nonverbal cues,CLLDL1n,page_24.png,"COMMUNICATION, LANGUAGE AND LITERACY DEVELOPMENT (CLLD)",CLLD1. COMMUNICATION
Early Toddler (12-24 months),indicator,"Begins to understand action words (e.g. hop, jump, run, go, stop)",CLLD1.1. Understanding verbal and nonverbal cues,CLLDL1o,page_24.png,"COMMUNICATION, LANGUAGE AND LITERACY DEVELOPMENT (CLLD)",CLLD1. COMMUNICATION
Early Toddler (12-24 months),indicator,"Completes a task in response to a request (e.g. pick up your cup, go find your coat)",CLLD1.1. Understanding verbal and nonverbal cues,CLLDL1p,page_24.png,"COMMUNICATION, LANGUAGE AND LITERACY DEVELOPMENT (CLLD)",CLLD1. COMMUNICATION
Early Toddler (12-24 months),indicator,"Names familiar people, animals, and objects (using gesture, words or sounds)",CLLD1.1. Understanding verbal and nonverbal cues,CLLDL1q,page_24.png,"COMMUNICATION, LANGUAGE AND LITERACY DEVELOPMENT (CLLD)",CLLD1. COMMUNICATION
Early Toddler (12-24 months),indicator,Begins to recognize some body parts,CLLD1.1. Understanding verbal and nonverbal cues,CLLDL1r,page_24.png,"COMMUNICATION, LANGUAGE AND LITERACY DEVELOPMENT (CLLD)",CLLD1. COMMUNICATION
Early Toddler (12-24 months),indicator,"Understands and responds to some pronouns (mine, you, me)",CLLD1.1. Understanding verbal and nonverbal cues,CLLDL1s,page_24.png,"COMMUNICATION, LANGUAGE AND LITERACY DEVELOPMENT (CLLD)",CLLD1. COMMUNICATION
Older Toddler (22-36 months),indicator,Listens to and attends to spoken language and read aloud texts,CLLD1.1. Understanding verbal and nonverbal cues,CLLDL1t,page_24.png,"COMMUNICATION, LANGUAGE AND LITERACY DEVELOPMENT (CLLD)",CLLD1. COMMUNICATION
Older Toddler (22-36 months),indicator,Follows simple and short directions for routine practices,CLLD1.1. Understanding verbal and nonverbal cues,CLLDL1u,page_24.png,"COMMUNICATION, LANGUAGE AND LITERACY DEVELOPMENT (CLLD)",CLLD1. COMMUNICATION
Older Toddler (22-36 months),indicator,Understands and responds to several hundred words or more,CLLD1.1. Understanding verbal and nonverbal cues,CLLDL1v,page_24.png,"COMMUNICATION, LANGUAGE AND LITERACY DEVELOPMENT (CLLD)",CLLD1. COMMUNICATION
Older Toddler (22-36 months),indicator,Understands and responds to basic attribute word differences such as personal (I/me/you) and possessive (my and mine) pronouns,CLLD1.1. Understanding verbal and nonverbal cues,CLLDL1w,page_24.png,"COMMUNICATION, LANGUAGE AND LITERACY DEVELOPMENT (CLLD)",CLLD1. COMMUNICATION
Older Toddler (22-36 months),indicator,Demonstrates understanding by answering questions,CLLD1.1. Understanding verbal and nonverbal cues,CLLDL1x,page_24.png,"COMMUNICATION, LANGUAGE AND LITERACY DEVELOPMENT (CLLD)",CLLD1. COMMUNICATION
Older Toddler (22-36 months),indicator,Follows two unrelated directions,CLLD1.1. Understanding verbal and nonverbal cues,CLLDL1y,page_24.png,"COMMUNICATION, LANGUAGE AND LITERACY DEVELOPMENT (CLLD)",CLLD1. COMMUNICATION
Older Toddler (22-36 months),indicator,"Understands and responds to spatial concepts (e.g. in/out, under, front, behind)",CLLD1.1. Understanding verbal and nonverbal cues,CLLDL1z,page_24.png,"COMMUNICATION, LANGUAGE AND LITERACY DEVELOPMENT (CLLD)",CLLD1. COMMUNICATION
Early Preschooler (34-48 months),indicator,Answers questions and adds comments relevant to the topic,CLLD1.1. Understanding verbal and nonverbal cues,CLLDL1aa,page_24.png,"COMMUNICATION, LANGUAGE AND LITERACY DEVELOPMENT (CLLD)",CLLD1. COMMUNICATION
Early Preschooler (34-48 months),indicator,"Begins to demonstrate understanding of implied messages based on speaker's tone and/or gestures (e.g. finger to lips paired with saying ""shh"" means be quiet)",CLLD1.1. Understanding verbal and nonverbal cues,CLLDL1ab,page_24.png,"COMMUNICATION, LANGUAGE AND LITERACY DEVELOPMENT (CLLD)",CLLD1. COMMUNICATION
Early Preschooler (34-48 months),indicator,"Understands and responds to words for descriptive concepts (e.g. hard, square)",CLLD1.1. Understanding verbal and nonverbal cues,CLLDL1ac,page_24.png,"COMMUNICATION, LANGUAGE AND LITERACY DEVELOPMENT (CLLD)",CLLD1. COMMUNICATION
Early Preschooler (34-48 months),indicator,Follows 2-3 step related directions and some new directions related to familiar and daily routines,CLLD1.1. Understanding verbal and nonverbal cues,CLLDL1ad,page_24.png,"COMMUNICATION, LANGUAGE AND LITERACY DEVELOPMENT (CLLD)",CLLD1. COMMUNICATION
Early Preschooler (34-48 months),indicator,"Demonstrates understanding of communication that includes a variety of complex sentences related to familiar stories, learning activities, and events (e.g. ""Alice said Clifford the dog came home, he played with Emily Elizabeth"")",CLLD1.1. Understanding verbal and nonverbal cues,CLLDL1ae,page_24.png,"COMMUNICATION, LANGUAGE AND LITERACY DEVELOPMENT (CLLD)",CLLD1. COMMUNICATION
Early Infancy (0-8 months),indicator,"Looks intently when others show they are happy, sad or fearful by their facial expressions, voices or actions (e.g., coos or smiles when an adult smiles and uses a friendly voice)",SED2.5. Showing care and concern for others,SED2.5a,page_18.png,SOCIAL AND EMOTIONAL DEVELOPMENT (SED),SED2. EMOTIONAL COMPETENCE
Later Infancy (6-14 months),indicator,"Responds to others' emotional expressions, often by a matching emotion or behavior (e.g., looks sad when another child is crying)",SED2.5. Showing care and concern for others,SED2.5b,page_18.png,SOCIAL AND EMOTIONAL DEVELOPMENT (SED),SED2. EMOTIONAL COMPETENCE
Early Toddler (12-24 months),indicator,"Tries to comfort another child or an adult who is upset (e.g., brings a comfort object, pats the person on the back)",SED2.5. Showing care and concern for others,SED2.5c,page_18.png,SOCIAL AND EMOTIONAL DEVELOPMENT (SED),SED2. EMOTIONAL COMPETENCE
Older Toddler (18-36 months),indicator,Expresses empathy toward other children who are crying by showing concerned attention; tries to comfort them with words or actions,SED2.5. Showing care and concern for others,SED2.5d,page_18.png,SOCIAL AND EMOTIONAL DEVELOPMENT (SED),SED2. EMOTIONAL COMPETENCE
Older Toddler (18-36 months),indicator,"Recognizes the needs of others and responds appropriately with support from adults (e.g., asks a teacher to help another child who fell and is crying)",SED2.5. Showing care and concern for others,SED2.5e,page_18.png,SOCIAL AND EMOTIONAL DEVELOPMENT (SED),SED2. EMOTIONAL COMPETENCE
Preschool (3-4 years),indicator,Expresses empathy toward adults who are sad by comforting them with words or actions,SED2.5. Showing care and concern for others,SED2.5f,page_18.png,SOCIAL AND EMOTIONAL DEVELOPMENT (SED),SED2. EMOTIONAL COMPETENCE
Preschool (3-4 years),indicator,"Relates complex emotions to self and others (e.g., says ""I am mad and she is sad."")",SED2.5. Showing care and concern for others,SED2.5g,page_18.png,SOCIAL AND EMOTIONAL DEVELOPMENT (SED),SED2. EMOTIONAL COMPETENCE
Preschool (4-5 years),indicator,"Shows care and concern for others, including comforting others in distress",SED2.5. Showing care and concern for others,SED2.5h,page_18.png,SOCIAL AND EMOTIONAL DEVELOPMENT (SED),SED2. EMOTIONAL COMPETENCE
Preschool (4-5 years),indicator,Begins to recognize the emotions of peers and responds with empathy,SED2.5. Showing care and concern for others,SED2.5i,page_18.png,SOCIAL AND EMOTIONAL DEVELOPMENT (SED),SED2. EMOTIONAL COMPETENCE
Preschool (4-5 years),indicator,"Begins to understand the reason for others' emotions and responds appropriately (e.g., asks why a classmate cried)",SED2.5. Showing care and concern for others,SED2.5j,page_18.png,SOCIAL AND EMOTIONAL DEVELOPMENT (SED),SED2. EMOTIONAL COMPETENCE
Early Infancy (0-8 months),indicator,"Shows interest in exploring writing by watching others write and experimenting with writing tools (e.g., tries using crayons, markers, finger paint to make marks)",CLLD3.2. Developing writing habits and skills,CLLD3.2a,page_32.png,"COMMUNICATION, LANGUAGE AND LITERACY DEVELOPMENT (CLLD)","CLLD3, FOUNDATIONS OF WRITING"
Later Infancy (6-14 months),indicator,"Begins to share drawing/writing and explains the meaning of the illustrations/text (e.g., says circle is a ball)",CLLD3.2. Developing writing habits and skills,CLLD3.2b,page_32.png,"COMMUNICATION, LANGUAGE AND LITERACY DEVELOPMENT (CLLD)","CLLD3, FOUNDATIONS OF WRITING"
Early Toddler (12-24 months),indicator,Shares writing with others as a way to represent their understandings and ideas,CLLD3.2. Developing writing habits and skills,CLLD3.2c,page_32.png,"COMMUNICATION, LANGUAGE AND LITERACY DEVELOPMENT (CLLD)","CLLD3, FOUNDATIONS OF WRITING"
Early Childhood (24-36 months),indicator,Begins to revise writing in the moment based on interactions with peers and adults,CLLD3.2. Developing writing habits and skills,CLLD3.2d,page_32.png,"COMMUNICATION, LANGUAGE AND LITERACY DEVELOPMENT (CLLD)","CLLD3, FOUNDATIONS OF WRITING"
Early Childhood (36-48 months),indicator,Begins to modify and expand their drawing/writing to meet personal interests and include others' ideas (several children begin drawing rainbows and unicorns after one child narrates their work),CLLD3.2. Developing writing habits and skills,CLLD3.2e,page_32.png,"COMMUNICATION, LANGUAGE AND LITERACY DEVELOPMENT (CLLD)","CLLD3, FOUNDATIONS OF WRITING"
Early Childhood (48-60 months),indicator,Continues to revise writing in the moment based on interactions with peers and adults,CLLD3.2. Developing writing habits and skills,CLLD3.2f,page_32.png,"COMMUNICATION, LANGUAGE AND LITERACY DEVELOPMENT (CLLD)","CLLD3, FOUNDATIONS OF WRITING"
Early Childhood (48-60 months),indicator,Begins to revise by adding details to drawings/ writings to express their ideas,CLLD3.2. Developing writing habits and skills,CLLD3.2g,page_32.png,"COMMUNICATION, LANGUAGE AND LITERACY DEVELOPMENT (CLLD)","CLLD3, FOUNDATIONS OF WRITING"
Early Childhood (48-60 months),indicator,"Begins to make a plan for the writing they will produce (e.g., creates picture to tell story and then writes)",CLLD3.2. Developing writing habits and skills,CLLD3.2h,page_32.png,"COMMUNICATION, LANGUAGE AND LITERACY DEVELOPMENT (CLLD)","CLLD3, FOUNDATIONS OF WRITING"
Early Infancy (0-8 months),indicator,Responds and engages with facial expressions to person,CLLD1.3. Learning and engaging in conversational interactions,CLLD1.3a,page_26.png,"COMMUNICATION, LANGUAGE AND LITERACY DEVELOPMENT (CLLD)","CLLD1, COMMUNICATION"
Early Infancy (0-8 months),indicator,"Begins vocal play with adults (coos, blows raspberries)",CLLD1.3. Learning and engaging in conversational interactions,CLLD1.3b,page_26.png,"COMMUNICATION, LANGUAGE AND LITERACY DEVELOPMENT (CLLD)","CLLD1, COMMUNICATION"
Early Infancy (0-8 months),indicator,Engages in vocal exchanges by babbling (using many sounds),CLLD1.3. Learning and engaging in conversational interactions,CLLD1.3c,page_26.png,"COMMUNICATION, LANGUAGE AND LITERACY DEVELOPMENT (CLLD)","CLLD1, COMMUNICATION"
Late Infancy (6-14 months),indicator,"Takes turns in conversation with a verbal or vocal response, or nonverbal gesture",CLLD1.3. Learning and engaging in conversational interactions,CLLD1.3d,page_26.png,"COMMUNICATION, LANGUAGE AND LITERACY DEVELOPMENT (CLLD)","CLLD1, COMMUNICATION"
Late Infancy (6-14 months),indicator,"Attends to speaker, then looks at what speaker is looking at (joint attention)",CLLD1.3. Learning and engaging in conversational interactions,CLLD1.3e,page_26.png,"COMMUNICATION, LANGUAGE AND LITERACY DEVELOPMENT (CLLD)","CLLD1, COMMUNICATION"
Early Toddler (12-24 months),indicator,Uses simple verbal and nonverbal responses to engage with others,CLLD1.3. Learning and engaging in conversational interactions,CLLD1.3f,page_26.png,"COMMUNICATION, LANGUAGE AND LITERACY DEVELOPMENT (CLLD)","CLLD1, COMMUNICATION"
Early Toddler (12-24 months),indicator,Begins to ask and respond to simple questions,CLLD1.3. Learning and engaging in conversational interactions,CLLD1.3g,page_26.png,"COMMUNICATION, LANGUAGE AND LITERACY DEVELOPMENT (CLLD)","CLLD1, COMMUNICATION"
Early Toddler (12-24 months),indicator,Begins to follow adult pointing or gaze to establish joint attention,CLLD1.3. Learning and engaging in conversational interactions,CLLD1.3h,page_26.png,"COMMUNICATION, LANGUAGE AND LITERACY DEVELOPMENT (CLLD)","CLLD1, COMMUNICATION"
Early Toddler (12-24 months),indicator,"Begins to match language to contexts (e.g. voice volume, inflection/rise and fall of voice in speaking, and parting/greeting ritual)",CLLD1.3. Learning and engaging in conversational interactions,CLLD1.3i,page_26.png,"COMMUNICATION, LANGUAGE AND LITERACY DEVELOPMENT (CLLD)","CLLD1, COMMUNICATION"
Later Toddler (18-36 months),indicator,Continues a conversation with several exchanges with or without adult help (may stay on topic or on task),CLLD1.3. Learning and engaging in conversational interactions,CLLD1.3j,page_26.png,"COMMUNICATION, LANGUAGE AND LITERACY DEVELOPMENT (CLLD)","CLLD1, COMMUNICATION"
Later Toddler (18-36 months),indicator,Alternates between speaker and listener roles,CLLD1.3. Learning and engaging in conversational interactions,CLLD1.3k,page_26.png,"COMMUNICATION, LANGUAGE AND LITERACY DEVELOPMENT (CLLD)","CLLD1, COMMUNICATION"
Later Toddler (18-36 months),indicator,Engages in multiple back-and-forth conversations with adults in ways that can be goal directed (such solving problems),CLLD1.3. Learning and engaging in conversational interactions,CLLD1.3l,page_26.png,"COMMUNICATION, LANGUAGE AND LITERACY DEVELOPMENT (CLLD)","CLLD1, COMMUNICATION"
Later Toddler (18-36 months),indicator,Asks and responds to questions with accurate information,CLLD1.3. Learning and engaging in conversational interactions,CLLD1.3m,page_26.png,"COMMUNICATION, LANGUAGE AND LITERACY DEVELOPMENT (CLLD)","CLLD1, COMMUNICATION"
Early Infancy (0-8 months),indicator,"Explores books by touching, patting, putting in mouth","CLLD2.1, Paying attention to print as meaningful",CLLD2.1a,page_27.png,"COMMUNICATION, LANGUAGE AND LITERACY DEVELOPMENT (CLLD)","CLLD2, FOUNDATIONS OF READING"
