Item Type,Sequence,Human Code,Full Statement,Abbreviated Statement,Notes,Supp. Info,Ed. Level,Language,Rewritten Statement
Developmental Milestones,4.8.6.6.10.2,V.C.5.b,Uses Punctuation in Writing,,,,PK,, Points to marks on a page while pretending to read or write.
Developmental Milestones,4.8.6.6.10.3,V.C.5.c,Understands the Need for Punctuation,,,,PK,,Uses pauses in speech like a period or comma when communicating.
Developmental Milestones,4.8.6.6.11,V.C.6,can write 3 words in two other indigenous languages,,Washington Stanard,,PK,, says three words in two other indigenous languages.
Domain,5,MATH,Domain #4: Mathematics Development/ Cognition,,,,,,
Standard,5.1,MATH.1,Child knows number names and the count sequence,,,,,,
Label,5.1.1,,Infants (INF 0-8) Learning Outcome,,,,,,
Developmental Milestones,5.1.1.1,,"Notices differences in the number of objects (e.g., one versus many).",,,,,,
Label,5.1.2,,Infants (INF 8-18) Learning Outcome,,,,,,
Developmental Milestones,5.1.2.1,,"Points to objects or shows interest in grouping items (e.g., stacking rings).",,,,,,
Label,5.1.3,,Toddler (TOD 18-24) Learning Outcome,,,,,,
Developmental Milestones,5.1.3.1,,"Begins using number words during play (e.g., “one, two”).",,,,,,
Label,5.1.4,,Toddler (TOD 24-36) Learning Outcome,,,,,,
Developmental Milestones,5.1.4.1,,Counts objects up to three with guidance.,,,,,,
Label,5.1.5,,Preschool Learning Outcome (BASE) (36-48) Learning Outcome,,,,,,
Developmental Milestones,5.1.5.1,MATH.1.a,Child can accurately identify numbers when named or written.,,,,,,
Developmental Milestones,5.1.5.2,MATH.1.b,Child can recite the numerical order sequence correctly.,,,,,,
Developmental Milestones,5.1.5.3,MATH.1.c,Child can associate specific quantities with their corresponding number names.,,,,,,
Label,5.1.6,,PreK Learning Outcomes (2020 Edition) (PreK 48-60) Learning Outcome,,,,,,
Standard,5.1.6.1,VI.A.13,Begins to write numerals,,,,PK,, Draws simple number shapes.
Developmental Milestones,5.1.6.1.1,VI.A.13.a,Recognizes and Identifies Numerals,,,,PK,,Points to and names numbers.
Developmental Milestones,5.1.6.1.2,VI.A.13.b,Understands the Concept of Numerals,,,,PK,, Points to or names numbers during play.
Developmental Milestones,5.1.6.1.3,VI.A.13.c,Mastering Number Formation,,,,PK,, Scribbles numbers with a crayon.
Standard,5.1.6.2,VI.A.12,Identifies quantity to 5 without counting,,,,PK,,Recognizes and names groups of up to 5 objects without counting.
Developmental Milestones,5.1.6.2.1,VI.A.12.a,Recognizes Numerals Up to 5,,,,PK,,- Points to numbers 1 to 5 when asked.
Developmental Milestones,5.1.6.2.2,VI.A.12.b,Understands Concepts of Quantity,,,,PK,,"- Points to or grabs more when asked for ""more"" or ""all."""
Developmental Milestones,5.1.6.2.3,VI.A.12.c,Estimation Skills,,,,PK,,• Tries to guess how many toys are in a small group.
Standard,5.1.6.3,VI.A.11,Uses ordinal terms,,,,PK,,"- Says words like ""first"" and ""second"" to describe order."
Developmental Milestones,5.1.6.3.1,VI.A.11.a,Identifies and applies ordinal terms in daily activities and routines.,,,,PK,,"- Uses words like ""first,"" ""next,"" and ""last"" while playing or during routines."
Developmental Milestones,5.1.6.3.2,VI.A.11.b,Associates ordinal terms with numerical order and sequential tasks.,,,,PK,,"- Uses words like ""first"" and ""last"" when talking about numbers and tasks."
Developmental Milestones,5.1.6.3.3,VI.A.11.c,"Uses ordinal terms correctly in meaningful contexts, such as storytelling or game playing.",,,,PK,,"- Says ""first,"" ""second,"" and ""third"" while playing games or telling stories."
Standard,5.1.6.4,VI.A.8,Recognizes and names numerals 0-9,,,,PK,,- Points to and says the names of numbers 0-9.
Developmental Milestones,5.1.6.4.1,VI.A.8.a,Identifying Numerals,,,,PK,, Points to and names numbers in familiar books or toys.
Developmental Milestones,5.1.6.4.2,VI.A.8.b,Number Naming,,,,PK,, says the names of numbers during play.
Developmental Milestones,5.1.6.4.3,VI.A.8.c,Numeric Association,,,,PK,, Points to or touches objects when counting.
Developmental Milestones,5.1.6.4.4,VI.A.8.d,Recognizes and names numerals 0-10.,,,,PK,,- Points to and says numbers from 0 to 10.
Developmental Milestones,5.1.6.4.5,VI.A.8.e,Recognize that zero represents the count of no objects.,,,,PK,,"- Understand that ""none"" means no toys are left."
Standard,5.1.6.5,VI.A.6,Knows last count shows how many,,,,PK,,Counts objects and says the total.
Developmental Milestones,5.1.6.5.1,VI.A.6.a,Identifying Numerical Values,,,,PK,, Points to or touches objects while counting them out loud.
Developmental Milestones,5.1.6.5.2,VI.A.6.b,Understanding Sequence of Numbers,,,,PK,,"- Counts objects in order, like ""one, two, three."""
Developmental Milestones,5.1.6.5.3,VI.A.6.c,Associating Numbers with Quantity,,,,PK,," ""Points to or picks up the right number of toys when asked."""
Standard,5.1.6.6,VI.A.5,Know counting sequence is constant,,,,PK,, say numbers in the same order each time.
Developmental Milestones,5.1.6.6.1,VI.A.5.a,Recognizing and Identifying Numbers,,,,PK,, Points to and names familiar numbers.
Developmental Milestones,5.1.6.6.2,VI.A.5.b,Sequential Counting,,,,PK,, Count numbers in order during playtime.
Developmental Milestones,5.1.6.6.3,VI.A.5.c,Constant Counting Principle,,,,PK,, Count objects in a group without skipping any.
Standard,5.1.6.7,VI.A.1,Rote counts to 5,,,,PK,,Counts out loud up to 5.
Developmental Milestones,5.1.6.7.1,VI.A.1.a,Recognizes and Recites Numbers 1-5,,,,PK,,- Points to and says numbers 1-5.
Developmental Milestones,5.1.6.7.2,VI.A.1.b,Understands Sequential Order,,,,PK,, Puts toys away in a specific order.
Developmental Milestones,5.1.6.7.3,VI.A.1.c,Applies Counting in Practical Situations,,,,PK,,Counts objects during play.
Standard,5.1.6.8,VI.A.2,Rote counts to 10,,,,PK,,- Says numbers in order up to 10.
Developmental Milestones,5.1.6.8.1,VI.A.2.a,Recognizes Numbers,,,,PK,, Points to or touches numbers when asked.
Developmental Milestones,5.1.6.8.2,VI.A.2.b,Sequential Numbering,,,,PK,,"- Count objects in order like ""one, two, three."""
Developmental Milestones,5.1.6.8.3,VI.A.2.c,Repetitive Number Recital,,,,PK,,"- Counts numbers in order, like saying ""one, two, three."""
Standard,5.1.6.9,VI.A.3,Rote counts to 30,,,,PK,,- Says numbers in order up to 30.
Developmental Milestones,5.1.6.9.1,VI.A.3.a,Identifies Numbers Up to 30,,,,PK,,- Points to and names numbers up to 30.
Developmental Milestones,5.1.6.9.2,VI.A.3.b,Counts Sequentially,,,,PK,, says numbers one after another.
Developmental Milestones,5.1.6.9.3,VI.A.3.c,Demonstrates Understanding Through Counting Objects,,,,PK,, Counts small groups of objects with curiosity.
Developmental Milestones,5.1.6.9.4,VI.A.3.d,Count aloud forward in sequence by 1s to 20,,,,PK,,- Say numbers in order up to 20.
Standard,5.1.6.10,VI.A.4,Counts objects one per count 1-10,,,,PK,,- Points to and counts each object up to 10 one by one.
Developmental Milestones,5.1.6.10.1,VI.A.4.a,Object Recognition and 1:1 correspondence up to 10.,,,,PK,, Matches objects one-to-one up to ten items.
Developmental Milestones,5.1.6.10.2,VI.A.4.b,Sequential Number Identification,,,,PK,, Points to and names numbers in order.
Developmental Milestones,5.1.6.10.3,VI.A.4.c,One-to-One Correspondence,,,,PK,, Matches one object to each item in a group.
Standard,5.2,MATH.2,Child recognizes the number of objects in a small set (subitizing),,,,,,
Label,5.2.1,,Infants (INF 0-8) Learning Outcome,,,,,,
Developmental Milestones,5.2.1.1,,"Explores objects by grasping and mouthing, noticing differences in size.",,,,,,
Label,5.2.2,,Infants (INF 8-18) Learning Outcome,,,,,,
Developmental Milestones,5.2.2.1,,"Stacks or nests objects, such as cups or blocks.",,,,,,
Label,5.2.3,,Toddler (TOD 18-24) Learning Outcome,,,,,,
Developmental Milestones,5.2.3.1,,Identifies “big” and “small” with prompts; begins to fill and empty containers.,,,,,,
Label,5.2.4,,Toddler (TOD 24-36) Learning Outcome,,,,,,
Developmental Milestones,5.2.4.1,,"Uses terms like “on,” “under,” and “in” to describe object placement.",,,,,,
Label,5.2.5,,Preschool Learning Outcome (BASE) (36-48) Learning Outcome,,,,,,
Developmental Milestones,5.2.5.1,MATH.2.a,Child can visually identify and name numbers 1-5 without counting.,,,,,,
Developmental Milestones,5.2.5.2,MATH.2.b,Child can group objects into sets equating to a given small number without counting.,,,,,,
Developmental Milestones,5.2.5.3,MATH.2.c,"Child can instantly recognize number patterns within 5 using arrays, dice patterns or fingers.",,,,,,
Label,5.2.6,,PreK Learning Outcomes (2020 Edition) (PreK 48-60) Learning Outcome,,,,,,
Standard,5.2.6.1,VI.B.3,Separates items up to 10 into equal groups,,,,PK,,Divides up to 10 objects into equal groups.
Developmental Milestones,5.2.6.1.1,VI.B.3.a,'Recognizes and understands the concept of number equality',,,,PK,, Matches groups of objects with the same number.
Developmental Milestones,5.2.6.1.2,VI.B.3.b,'Identifies a collection of items up to 10 and can evenly distribute them',,,,PK,,- Counts and shares up to 10 toys or objects evenly with friends.
Developmental Milestones,5.2.6.1.3,VI.B.3.c,'Demonstrates basic understanding of division by separating items into equal groups',,,,PK,, Sorts toys into equal groups during play.
Standard,5.3,MATH.3,Child understands the relationship between numbers and quantities,,,,,,
Label,5.3.1,,Infants (INF 0-8) Learning Outcome,,,,,,
Developmental Milestones,5.3.1.1,,"Reacts to repetitive sounds or movements, such as clapping.",,,,,,
Label,5.3.2,,Infants (INF 8-18) Learning Outcome,,,,,,
Developmental Milestones,5.3.2.1,,"Imitates simple patterns in actions, such as banging two objects together.",,,,,,
Label,5.3.3,,Toddler (TOD 18-24) Learning Outcome,,,,,,
Developmental Milestones,5.3.3.1,,Matches similar objects or colors to form simple sequences.,,,,,,
Label,5.3.4,,Toddler (TOD 24-36) Learning Outcome,,,,,,
Developmental Milestones,5.3.4.1,,"Recognizes AB patterns (e.g., red-blue-red-blue).",,,,,,
Label,5.3.5,,Preschool Learning Outcome (BASE) (36-48) Learning Outcome,,,,,,
Developmental Milestones,5.3.5.1,MATH.3.b,Child can order quantities according to number sequence,,,,,,
Developmental Milestones,5.3.5.2,MATH.3.c,Child can perform simple addition and subtraction with quantities,,,,,,
Developmental Milestones,5.3.5.3,MATH.3.a,Child can match numbers with corresponding quantities,,,,,,
Label,5.3.6,,PreK Learning Outcomes (2020 Edition) (PreK 48-60) Learning Outcome,,,,,,
Standard,5.3.6.1,VI.A.7,Counts objects in any order,,,,PK,, Points to and Counts toys or items in any order.
Developmental Milestones,5.3.6.1.1,VI.A.7.a,Identification and Naming of Objects,,,,PK,,Points to and names familiar objects.
Developmental Milestones,5.3.6.1.2,VI.A.7.b,Understanding of Number Concepts,,,,PK,, Points to or touches objects while counting them.
Developmental Milestones,5.3.6.1.3,VI.A.7.c,Sequential Ordering and Counting,,,,PK,, Stack blocks in order while counting each one.
Developmental Milestones,5.3.6.1.4,VI.A.7.d,Count up to 5 items in a scattered configuration; not in a row or column.,,,,PK,,Point to and count up to 5 toys scattered on the floor.
Standard,5.3.6.2,VI.A.9,Connects numbers with quantities,,,,PK,, Matches numbers to the right number of objects.
Developmental Milestones,5.3.6.2.1,VI.A.9.a,Recognizes and Identifies Numerals,,,,PK,, Points to and names numbers they see.
Developmental Milestones,5.3.6.2.2,VI.A.9.b,Counting and Matching Quantities,,,,PK,, Points to and Counts objects during play.
Developmental Milestones,5.3.6.2.3,VI.A.9.c,Comparing and Contrasting Quantities,,,,PK,,Notice when one group of toys has more or fewer items than another.
Developmental Milestones,5.3.6.2.4,VI.A.9.d,Child represents quantities up to 10.,,,,PK,,- Counts up to 10 objects using fingers or words.
Developmental Milestones,5.3.6.2.5,VI.A.9.e,Child begins to understand that numbers 0-10 can be composed and decomposed in various ways to represent a quantity.,,,,PK,, groups and separates small sets of objects to show different ways to make the same number.
Standard,5.4,MATH.4,Child compares numbers,,,,,,
Label,5.4.1,,Infants (INF 0-8) Learning Outcome,,,,,,
Developmental Milestones,5.4.1.1,,"Explores objects by mouthing, grasping, or banging, noticing different weights or textures.",,,,,,
Label,5.4.2,,Infants (INF 8-18) Learning Outcome,,,,,,
Developmental Milestones,5.4.2.1,,Compares sizes by choosing larger or smaller objects.,,,,,,
Label,5.4.3,,Toddler (TOD 18-24) Learning Outcome,,,,,,
Developmental Milestones,5.4.3.1,,Sorts objects by size or weight with guidance.,,,,,,
Label,5.4.4,,Toddler (TOD 24-36) Learning Outcome,,,,,,
Developmental Milestones,5.4.4.1,,"Identifies objects as “big” or “small,” “heavy” or “light.”",,,,,,
Label,5.4.5,,Preschool Learning Outcome (BASE) (36-48) Learning Outcome,,,,,,
Developmental Milestones,5.4.5.1,MATH.4.a,Child identifies larger and smaller quantities.,,,,,,
Developmental Milestones,5.4.5.2,MATH.4.c,Child can arrange numbers in ascending and descending order.,,,,,,
Developmental Milestones,5.4.5.3,MATH.4.b,"Child understands and uses terms related to quantity comparison (more, less, equal).",,,,,,
Label,5.4.6,,PreK Learning Outcomes (2020 Edition) (PreK 48-60) Learning Outcome,,,,,,
Standard,5.4.6.1,VI.A.10,Compares quantities,,,,PK,, Notices when one group of toys has more than another.
Developmental Milestones,5.4.6.1.1,VI.A.10.a,Identifying More or Less,,,,PK,,Compare two groups of objects and point to the one with more or less items.
Developmental Milestones,5.4.6.1.2,VI.A.10.b,"Child compares sets of objects up to 10 using comparative language (e.g., greater/more than, less/fewer than, equal to/same number of).",,,,PK,, Points to or says which group of toys has more or fewer.
Developmental Milestones,5.4.6.1.3,VI.A.10.c,Estimation Skills,,,,PK,,Stacks blocks to match the height of a tower.
Standard,5.5,MATH.5,Child associates a quantity with written numerals up to 5 and begins to write numbers,,,,,,
Label,5.5.1,,Infants (INF 0-8) Learning Outcome,,,,,,
Developmental Milestones,5.5.1.1,,"Notices different quantities (e.g., one toy versus many).",,,,,,
Label,5.5.2,,Infants (INF 8-18) Learning Outcome,,,,,,
Developmental Milestones,5.5.2.1,,"Groups objects during play, such as stacking blocks or sorting rings",,,,,,
Label,5.5.3,,Toddler (TOD 18-24) Learning Outcome,,,,,,
Developmental Milestones,5.5.3.1,,"Points to objects while attempting to count (e.g., “one, two”).",,,,,,
Label,5.5.4,,Toddler (TOD 24-36) Learning Outcome,,,,,,
Developmental Milestones,5.5.4.1,,"Begins recognizing numerals (e.g., points to the “3” when prompted).",,,,,,
Label,5.5.5,,Preschool Learning Outcome (BASE) (36-48) Learning Outcome,,,,,,
Developmental Milestones,5.5.5.1,MATH.5.a,Child recognizes and accurately counts objects up to five.,,,,,,
Developmental Milestones,5.5.5.2,MATH.5.c,Child begins to practice writing numerals up to five correctly.,,,,,,
Developmental Milestones,5.5.5.3,MATH.5.b,Child matches written numerals to their corresponding quantities up to five.,,,,,,
Label,5.5.6,,PreK Learning Outcomes (2020 Edition) (PreK 48-60) Learning Outcome,,,,,,
Standard,5.5.6.1,VI.B.1,Uses objects/pictures to add up to 5 objects,,,,PK,,Counts up to 5 objects using toys or pictures.
Developmental Milestones,5.5.6.1.1,VI.B.1.a,Identifies and Counts Objects/Pictures,,,,PK,, Points to and Counts objects or pictures.
Developmental Milestones,5.5.6.1.2,VI.B.1.b,Understands the Concept of Addition,,,,PK,,Stacks blocks and counts them to see the total.
Developmental Milestones,5.5.6.1.3,VI.B.1.c,Applies Addition to Combine Objects/Pictures,,,,PK,, Puts together two groups of toys and Counts how many there are in total.
Standard,5.5.6.2,VI.B.2,Uses objects/pictures to subtract objects from set 0-5,,,,PK,,Takes away objects from a group of 0-5 using toys or pictures.
Developmental Milestones,5.5.6.2.1,VI.B.2.a,Applies subtraction using pictures/objects,,,,PK,, Takes away toys to see how many are left.
Standard,5.6,MATH.6,Child understands addition as adding to and understands subtraction as taking away from,,,,,,
Label,5.6.1,,Infants (INF 0-8) Learning Outcome,,,,,,
Developmental Milestones,5.6.1.1,,"Watches as objects are added or removed (e.g., during play).",,,,,,
Label,5.6.2,,Infants (INF 8-18) Learning Outcome,,,,,,
Developmental Milestones,5.6.2.1,,"Reacts to changes in quantities, such as surprise when objects disappear.",,,,,,
Label,5.6.3,,Toddler (TOD 18-24) Learning Outcome,,,,,,
Developmental Milestones,5.6.3.1,,Combines or separates small groups of objects with guidance.,,,,,,
Label,5.6.4,,Toddler (TOD 24-36) Learning Outcome,,,,,,
Developmental Milestones,5.6.4.1,,"Adds or removes items during play (e.g., “I’ll give you two blocks”).",,,,,,
Label,5.6.5,,Preschool Learning Outcome (BASE) (36-48) Learning Outcome,,,,,,
Developmental Milestones,5.6.5.1,MATH.6.a,"""Child can use objects to demonstrate addition as 'adding to' in practical scenarios.""",,,,,,
Developmental Milestones,5.6.5.2,MATH.6.b,"""Child can apply the concept of 'taking away from' when solving simple subtraction problems.""",,,,,,
Developmental Milestones,5.6.5.3,MATH.6.c,"""Child can differentiate between addition and subtraction and identify their appropriate use in real-life situations.""",,,,,,
Label,5.6.6,,PreK Learning Outcomes (2020 Edition) (PreK 48-60) Learning Outcome,,,,,,
Standard,5.6.6.1,VI.B.5,Knows counting sequence is constant,,,,PK,, says numbers in the same order during play.
Developmental Milestones,5.6.6.1.1,VI.B.5.a,'Understands that numbers follow a specific order',,,,PK,, says numbers in the right order while counting.
Developmental Milestones,5.6.6.1.2,VI.B.5.b,'Recognizes the stability of the counting sequence',,,,PK,, Counts numbers in order without skipping.
Developmental Milestones,5.6.6.1.3,VI.B.5.c,'Applies consistent counting sequence in different contexts',,,,PK,, Counts objects in order during play.
Standard,5.6.6.2,VI.B.4,Understands addition as putting together and adding to,,,,PK,, Combines toys or objects to make a bigger group.
Developmental Milestones,5.6.6.2.1,VI.B.4.a,Ability to Identify Number Values,,,,PK,,Points to or says numbers while counting objects.
Developmental Milestones,5.6.6.2.2,VI.B.4.b,Mathematical Manipulatives Understanding,,,,PK,, Stacks and Sorts blocks by color and size.
Developmental Milestones,5.6.6.2.3,VI.B.4.c,Application of Addition in Everyday Context,,,,PK,, Counts objects and adds them together during play.
Standard,5.7,MATH.7,Child understands simple patterns,,,,,,
Label,5.7.1,,Infants (INF 0-8) Learning Outcome,,,,,,
Developmental Milestones,5.7.1.1,,"Recognizes repetitive patterns in sounds, such as lullabies.",,,,,,
Label,5.7.2,,Infants (INF 8-18) Learning Outcome,,,,,,
Developmental Milestones,5.7.2.1,,"Responds to visual patterns, like stripes or checkers.",,,,,,
Label,5.7.3,,Toddler (TOD 18-24) Learning Outcome,,,,,,
Developmental Milestones,5.7.3.1,,"Matches objects to continue a simple pattern (e.g., toy-car-toy).",,,,,,
Label,5.7.4,,Toddler (TOD 24-36) Learning Outcome,,,,,,
Developmental Milestones,5.7.4.1,,"Recognizes and extends AB patterns (e.g., red-blue-red-blue).",,,,,,
Label,5.7.5,,Preschool Learning Outcome (BASE) (36-48) Learning Outcome,,,,,,
Developmental Milestones,5.7.5.1,MATH.7.a,"Child identifies and describes simple sequences of objects based on their characteristics (color, shape, size, etc.).",,,,,,
Developmental Milestones,5.7.5.2,MATH.7.b,Child predicts what comes next in a simple pattern.,,,,,,
Developmental Milestones,5.7.5.3,MATH.7.c,Child recreates or continues a simple pattern using physical objects or images.,,,,,,
Label,5.7.6,,PreK Learning Outcomes (2020 Edition) (PreK 48-60) Learning Outcome,,,,,,
Standard,5.7.6.1,VI.E.4,Recognizes patterns,,,,PK,, Spots repeated shapes or colors in a sequence.
Developmental Milestones,5.7.6.1.1,VI.E.4.a,Identifies Simple Patterns,,,,PK,, Matches and recognizes repeating colors or shapes.
Developmental Milestones,5.7.6.1.2,VI.E.4.b,Predicts Patterns,,,,PK,, Notices and expects what comes next in a familiar sequence.
Developmental Milestones,5.7.6.1.3,VI.E.4.c,Creates Patterns,,,,PK,,Stacks blocks in a repeating color sequence.
Standard,5.7.6.2,VI.E.5,Creates and extends patterns,,,,PK,, Spots and adds to simple patterns during play.
Developmental Milestones,5.7.6.2.1,VI.E.5.a,Duplicates Patterns,,,,PK,, Copies simple patterns using blocks or toys.
Developmental Milestones,5.7.6.2.2,VI.E.5.b,Constructs Simple Patterns,,,,PK,, Stacks blocks in a repeating color order.
Developmental Milestones,5.7.6.2.3,VI.E.5.c,Expands Existing Patterns,,,,PK,,Builds on familiar patterns during play.
Standard,5.8,MATH.8,Child measures objects by their various attributes using standard and non-standard measurement; uses differences in attributes to make comparisons,,,,,,
Label,5.8.1,,Infants (INF 0-8) Learning Outcome,,,,,,
Developmental Milestones,5.8.1.1,,Explores objects of different sizes and weights by touching or mouthing.,,,,,,
Label,5.8.2,,Infants (INF 8-18) Learning Outcome,,,,,,
Developmental Milestones,5.8.2.1,,Begins stacking objects of similar size.,,,,,,
Label,5.8.3,,Toddler (TOD 18-24) Learning Outcome,,,,,,
Developmental Milestones,5.8.3.1,,Matches or lines up objects by size with support.,,,,,,
Label,5.8.4,,Toddler (TOD 24-36) Learning Outcome,,,,,,
Developmental Milestones,5.8.4.1,,"Uses hands or other items to compare object sizes (e.g., “This block is longer”).",,,,,,
Label,5.8.5,,Preschool Learning Outcome (BASE) (36-48) Learning Outcome,,,,,,
Developmental Milestones,5.8.5.1,MATH.8.a,Understanding of Measurement,,,,,,
Developmental Milestones,5.8.5.2,MATH.8.b,Application of Measurement,,,,,,
Developmental Milestones,5.8.5.3,MATH.8.c,Comparison and Differentiation,,,,,,
Label,5.8.6,,PreK Learning Outcomes (2020 Edition) (PreK 48-60) Learning Outcome,,,,,,
Standard,5.8.6.1,VI.D.1,Measures and compares lengths/heights,,,,PK,,Stacks and compares blocks to see which is taller.
Developmental Milestones,5.8.6.1.1,VI.D.1.a,Recognize and Understand Basic Units of Measurement,,,,PK,,Notice when things are big or small.
Developmental Milestones,5.8.6.1.2,VI.D.1.b,Using Comparative Language,,,,PK,,"- **Says words like ""bigger"" or ""smaller"" when comparing objects.**"
Developmental Milestones,5.8.6.1.3,VI.D.1.c,Hands-on Measurement Activities,,,,PK,,- **Stack blocks to see how tall they are.**
Standard,5.8.6.2,VI.D.3,Uses time words,,,,PK,,"- Says words like ""yesterday"" and ""tomorrow."""
Developmental Milestones,5.8.6.2.1,VI.D.3.a,Recognizes and Names Time Words,,,,PK,,"- Says words like ""now,"" ""later,"" or ""soon"" during play."
Developmental Milestones,5.8.6.2.2,VI.D.3.b,Applies Time Words in Context,,,,PK,,"Uses words like ""now,"" ""later,"" or ""soon"" while playing or during daily routines."
Developmental Milestones,5.8.6.2.3,VI.D.3.c,Differentiates Between Time Words,,,,PK,,"Uses words like ""now"" and ""later"" during play."
Standard,5.8.6.3,VI.D.2,Compares weights,,,,PK,, Lifts two objects and Notices which one is heavier.
Developmental Milestones,5.8.6.3.1,VI.D.2.a,Identifies Heavier and Lighter Objects,,,,PK,,Lifts and compares two objects to see which one feels heavier or lighter.
Developmental Milestones,5.8.6.3.2,VI.D.2.b,Uses Comparative Language,,,,PK,,"- Says words like ""bigger"" or ""smaller"" when comparing objects."
Developmental Milestones,5.8.6.3.3,VI.D.2.c,Makes Predictions About Weights,,,,PK,, Lifts and compares objects to guess which one is heavier.
Standard,5.8.6.4,VI.D.4,Child recognizes and compares capacity based on how much space exists within an object.,,NEW,,PK,,Stacks and fills containers to explore how much they can hold.
Standard,5.9,MATH.9,"Child identifies, describes, compares, and composes shapes",,,,,,
Label,5.9.1,,Infants (INF 0-8) Learning Outcome,,,,,,
Developmental Milestones,5.9.1.1,,"Looks at and tracks simple shapes, such as circles or squares.",,,,,,
Label,5.9.2,,Infants (INF 8-18) Learning Outcome,,,,,,
Developmental Milestones,5.9.2.1,,Reaches for or plays with toys of distinct shapes.,,,,,,
Label,5.9.3,,Toddler (TOD 18-24) Learning Outcome,,,,,,
Developmental Milestones,5.9.3.1,,"Sorts objects by shape (e.g., circle blocks versus square blocks).",,,,,,
Label,5.9.4,,Toddler (TOD 24-36) Learning Outcome,,,,,,
Developmental Milestones,5.9.4.1,,Identifies and names common shapes like “circle” and “triangle.”,,,,,,
Label,5.9.5,,Preschool Learning Outcome (BASE) (36-48) Learning Outcome,,,,,,
Developmental Milestones,5.9.5.1,MATH.9.a,Recognizes differences in shapes,,,,,,
Developmental Milestones,5.9.5.2,MATH.9.b,Can describe shapes with basic language,,,,,,
Developmental Milestones,5.9.5.3,MATH.9.c,"Compare, compose and explore shapes",,,,,,
Label,5.9.6,,PreK Learning Outcomes (2020 Edition) (PreK 48-60) Learning Outcome,,,,,,
Standard,5.9.6.1,VI.C.1,Names common shapes,,,,PK,,Points to and says names of shapes like circles and squares.
Developmental Milestones,5.9.6.1.1,VI.C.1.a,Identifies Basic Geometric Shapes,,,,PK,,Points to or names simple shapes like circles and squares.
Developmental Milestones,5.9.6.1.2,VI.C.1.b,Distinguishes Among Shapes,,,,PK,, recognizes and Points to different shapes.
Developmental Milestones,5.9.6.1.3,VI.C.1.c,Names Shapes in Various Orientations and Sizes,,,,PK,,"Points to and names shapes, even when they look different."
Standard,5.9.6.2,VI.C.2,Creates shapes,,,,PK,, Stacks blocks to make a tower.
Developmental Milestones,5.9.6.2.1,VI.C.2.a,Identifies Basic Shapes,,,,PK,," Points to and names circles, squares, and triangles."
