Item Type,Sequence,Human Code,Full Statement,Abbreviated Statement,Notes,Supp. Info,Ed. Level,Language,Rewritten Statement
Developmental Milestones,5.9.6.2.2,VI.C.2.b,Draws Basic Shapes,,,,PK,, Scribbles to create simple shapes like circles and lines.
Developmental Milestones,5.9.6.2.3,VI.C.2.c,Child creates shapes using materials and/or manipulatives.,,,,PK,,Stacks and arranges blocks to make simple shapes.
Standard,5.9.6.3,VI.C.3,Compares shapes,,,,PK,, Picks up and Looks at different shapes.
Developmental Milestones,5.9.6.3.1,VI.C.3.a,Identifies Basic Shapes,,,,PK,," Points to or names circles, squares, and triangles."
Developmental Milestones,5.9.6.3.2,VI.C.3.b,Differentiates Between Shapes,,,,PK,,- Points to or touches shapes to show they know they're different.
Developmental Milestones,5.9.6.3.3,VI.C.3.c,Categorizes Shapes,,,,PK,,Sorts and groups different shapes.
Standard,5.9.6.4,VI.C.4,Identifies shape attributes,,,,PK,, Points to or Picks up different shapes.
Developmental Milestones,5.9.6.4.1,VI.C.4.a,Distinguishes between Geometric Shapes,,,,PK,, Picks up and Plays with different shapes like circles and squares.
Developmental Milestones,5.9.6.4.2,VI.C.4.b,Recognition of Shape Attributes,,,,PK,, Points to or grabs shapes like circles and squares.
Developmental Milestones,5.9.6.4.3,VI.C.4.c,Application and description of shape attributes to Real-world Objects,,,,PK,, recognizes and Points to shapes in everyday objects.
Standard,5.1,MATH.10,Child explores the positions of objects in space,,,,,,
Label,5.10.1,,Infants (INF 0-8) Learning Outcome,,,,,,
Developmental Milestones,5.10.1.1,,"Reaches for objects placed in different positions (e.g., above, beside, or in front).",,,,,,
Label,5.10.2,,Infants (INF 8-18) Learning Outcome,,,,,,
Developmental Milestones,5.10.2.1,,Searches for objects hidden under or behind others during play.,,,,,,
Label,5.10.3,,Toddler (TOD 18-24) Learning Outcome,,,,,,
Developmental Milestones,5.10.3.1,,"Places objects in specific positions during play, such as stacking blocks in order or aligning cars.",,,,,,
Label,5.10.4,,Toddler (TOD 24-36) Learning Outcome,,,,,,
Developmental Milestones,5.10.4.1,,Demonstrates understanding of positional words by correctly placing objects when instructed.,,,,,,
Label,5.10.5,,Preschool Learning Outcome (BASE) (36-48) Learning Outcome,,,,,,
Developmental Milestones,5.10.5.1,MATH.10.a,Child Identifies Relative Positions,,,,,,
Developmental Milestones,5.10.5.2,MATH.10.b,Child Manipulates Objects,,,,,,
Developmental Milestones,5.10.5.3,MATH.10.c,Child Understands Directionality,,,,,,
Label,5.10.6,,PreK Learning Outcomes (2020 Edition) (PreK 48-60) Learning Outcome,,,,,,
Standard,5.10.6.1,VI.C.5,Uses location words,,,,PK,,"Points to or says words like ""under"" or ""next to"" when talking about where things are."
Developmental Milestones,5.10.6.1.1,VI.C.5.a,Identifies and Correctly Uses Basic Location Words,,,,PK,,"- Points to or moves objects when hearing words like ""in,"" ""on,"" or ""under."""
Developmental Milestones,5.10.6.1.2,VI.C.5.b,Understands Directional Statements,,,,PK,,"Follows simple directions like ""up"" and ""down."""
Developmental Milestones,5.10.6.1.3,VI.C.5.c,Describes Objects' Positions Relative to Other Objects,,,,PK,,"Points to or places objects next to, under, or on top of other objects."
Standard,5.10.6.2,VI.C.6,"Slides, flips, turns shapes",,,,PK,," moves shapes around by sliding, flipping, or turning them."
Developmental Milestones,5.10.6.2.1,VI.C.6.a,Understanding and Identifying Geometric Movements,,,,PK,, moves objects in circles or lines while playing.
Developmental Milestones,5.10.6.2.2,VI.C.6.b,Application of Geometric Movements,,,,PK,, Stacks blocks to make simple shapes.
Developmental Milestones,5.10.6.2.3,VI.C.6.c,Relating Movements to Real World Elements,,,,PK,, moves like animals or objects they see in their environment.
Standard,5.10.6.3,VI.C.7,Recognizes shapes in real world,,,,PK,, Points to or touches familiar shapes in everyday objects.
Developmental Milestones,5.10.6.3.1,VI.C.7.a,Identifies Basic Shapes,,,,PK,," Points to or touches circles, squares, and triangles."
Developmental Milestones,5.10.6.3.2,VI.C.7.b,Applies Shape Recognition,,,,PK,,• Picks out and names shapes like circles and squares.
Developmental Milestones,5.10.6.3.3,VI.C.7.c,Compares and Differentiates Shapes,,,,PK,, Points to and names different shapes.
Cluster,5.11,SCI,Scientific Reasoning,,,,,,
Standard,5.11.1,SCI.1,"Child observes and describes observable phenomena (objects, materials, organisms, and events)",,,,,,
Label,5.11.1.1,,Infants (INF 0-8) Learning Outcome,,,,,,
Developmental Milestones,5.11.1.1.1,,Reaches out to touch and explore objects with different textures.,,,,,,
Label,5.11.1.2,,Infants (INF 8-18) Learning Outcome,,,,,,
Developmental Milestones,5.11.1.2.1,,"Watches and tracks events, like a ball rolling or water flowing.",,,,,,
Label,5.11.1.3,,Toddler (TOD 18-24) Learning Outcome,,,,,,
Developmental Milestones,5.11.1.3.1,,"Describes basic features of objects, such as color or shape.",,,,,,
Label,5.11.1.4,,Toddler (TOD 24-36) Learning Outcome,,,,,,
Developmental Milestones,5.11.1.4.1,,Uses simple descriptive language to share observations.,,,,,,
Label,5.11.1.5,,Preschool Learning Outcome (BASE) (36-48) Learning Outcome,,,,,,
Developmental Milestones,5.11.1.5.1,SCI.1.a,Child Identifies and Classifies Observable Materials,,,,,,
Developmental Milestones,5.11.1.5.2,SCI.1.b,Child Demonstrates Basic Observation Techniques with Organisms and Events,,,,,,
Developmental Milestones,5.11.1.5.3,SCI.1.c,Child Expresses Thoughts and Findings Verbally or Through Art,,,,,,
Label,5.11.1.6,,PreK Learning Outcomes (2020 Edition) (PreK 48-60) Learning Outcome,,,,,,
Standard,5.11.1.6.1,VII.C.3,Observes changes in earth and sky,,,,PK,, Points to the sky when clouds or stars change.
Developmental Milestones,5.11.1.6.2,VII.C.3.b,Recognizing Day and Night Cycle,,,,PK,,- Notices when it’s light or dark outside.
Developmental Milestones,5.11.1.6.3,VII.C.3.c,Describes changes in the earth and sky.,,,,PK,, Points at the moon or clouds in the sky.
Developmental Milestones,5.11.1.6.4,VII.C.3.a,Identifying Different Weather Patterns,,,,PK,," Points to pictures of sunny, rainy, and snowy weather."
Standard,5.11.1.6.5,VII.C.2,Identifies objects in day and night sky,,,,PK,,Points to or names things they see in the sky during the day or night.
Developmental Milestones,5.11.1.6.5.1,VII.C.2.a,Differentiates between Day and Night,,,,PK,, recognizes daytime by staying active and nighttime by getting sleepy.
Developmental Milestones,5.11.1.6.5.2,VII.C.2.b,Recognizes Celestial Objects,,,,PK,, Points to the moon and stars in the sky.
Developmental Milestones,5.11.1.6.5.3,VII.C.2.c,Understands Sky Patterns,,,,PK,,Looks up and notices changes in the sky.
Developmental Milestones,5.11.1.6.5.4,VII.C.2.d,"Child identifies, observes, describes, and discusses objects in the sky.",,,,PK,,Points to and talks about things in the sky.
Standard,5.11.1.6.6,VII.B.6,Explores five senses,,,,PK,,"Uses eyes, ears, nose, mouth, and hands to explore the world."
Developmental Milestones,5.11.1.6.6.1,VII.B.6.a,Identifies and Differentiates Between the Five Senses,,,,PK,," Points to eyes, ears, nose, mouth, and hands to show how they explore the world."
Developmental Milestones,5.11.1.6.6.2,VII.B.6.b,Experience Based Learning Through Senses,,,,PK,," Explores the world by touching, tasting, smelling, seeing, and hearing."
Developmental Milestones,5.11.1.6.6.3,VII.B.6.c,Applies Knowledge of Five Senses to Real World,,,,PK,,Uses senses to explore and understand the world.
Standard,5.11.1.6.7,VII.A.1,Explores changes in matter,,,,PK,, Plays with water by pouring it from one container to another.
Developmental Milestones,5.11.1.6.7.1,VII.A.1.a,Identifies Different States of Matter,,,,PK,," Points to or touches water, ice, and steam to show they are different."
Developmental Milestones,5.11.1.6.7.2,VII.A.1.b,Observes and Describes Changes,,,,PK,,"""Notices and talks about things that are different."""
Developmental Milestones,5.11.1.6.7.3,VII.A.1.c,Conducts Simple Experiments,,,,PK,, Tries out new things to see what happens.
Standard,5.11.1.6.8,VI.F.1,Connects math to the real world,,,,PK,, Matches objects of different sizes or colors during play.
Developmental Milestones,5.11.1.6.8.1,VI.F.1.a,Recognizes Real-World Math Concepts,,,,PK,,Stacks blocks in different sizes and counts them.
Developmental Milestones,5.11.1.6.8.2,VI.F.1.b,Applies Math in Practical Situations,,,,PK,,Sorts toys by size or color during playtime.
Developmental Milestones,5.11.1.6.8.3,VI.F.1.c,Interprets Everyday Math Situations,,,,PK,," Notices and Plays with shapes, sizes, or patterns during play."
Standard,5.11.1.6.9,VII.B.2,Recognizes plants/animals grow and change,,,,PK,, Notices when plants or animals look different over time.
Developmental Milestones,5.11.1.6.9.1,VII.B.2.a,Identifies Different Stages of Plant and Animal Life Cycle,,,,PK,," Points to or names different stages of plant or animal life, like seeds or baby animals."
Developmental Milestones,5.11.1.6.9.2,VII.B.2.b,Understands Basic Differences in Growth Rates,,,,PK,,Notices when some things grow faster than others.
Developmental Milestones,5.11.1.6.9.3,VII.B.2.c,Grasps the Cause and Effect Relationship in Growth and Change,,,,PK,, Pushes a button to make a toy light up.
Standard,5.11.1.6.10,VII.D.6,Makes observations,,,,PK,, Points to or Looks closely at new things.
Developmental Milestones,5.11.1.6.10.1,VII.D.6.a,"Demonstrates the ability to recognize and describe different objects, phenomena, or events in their environment.",,,,PK,, Points to or names objects or events they notice around them.
Developmental Milestones,5.11.1.6.10.2,VII.D.6.b,Shows proficiency in making comparisons and recognizing patterns or changes over time.,,,,PK,, Notices and Points out differences or patterns in toys or objects.
Developmental Milestones,5.11.1.6.10.3,VII.D.6.c,Displays skills in recording or sharing observations verbally or through drawings or writings.,,,,PK,, Draws or talks about what they see around them.
Standard,5.11.2,SCI.2,Child engages in scientific talk,,,,,,
Label,5.11.2.1,,Infants (INF 0-8) Learning Outcome,,,,,,
Developmental Milestones,5.11.2.1.1,,Makes sounds or gestures when interacting with new phenomena.,,,,,,
Label,5.11.2.2,,Infants (INF 8-18) Learning Outcome,,,,,,
Developmental Milestones,5.11.2.2.1,,Uses gestures or babbling to “comment” on objects of interest.,,,,,,
Label,5.11.2.3,,Toddler (TOD 18-24) Learning Outcome,,,,,,
Developmental Milestones,5.11.2.3.1,,Participates in back-and-forth exchanges about observable phenomena.,,,,,,
Label,5.11.2.4,,Toddler (TOD 24-36) Learning Outcome,,,,,,
Developmental Milestones,5.11.2.4.1,,"Attempts to answer simple questions, such as “What is it doing?”",,,,,,
Label,5.11.2.5,,Preschool Learning Outcome (BASE) (36-48) Learning Outcome,,,,,,
Developmental Milestones,5.11.2.5.1,SCI.2.b,Child asks inquiry-based questions,,,,,,
Developmental Milestones,5.11.2.5.2,SCI.2.a,Child uses appropriate and specific scientific vocabulary,,,,,,
Developmental Milestones,5.11.2.5.3,SCI.2.c,Child articulates observations and hypothesis,,,,,,
Label,5.11.2.6,,PreK Learning Outcomes (2020 Edition) (PreK 48-60) Learning Outcome,,,,,,
Standard,5.11.2.6.1,VII.D.1,Engages in scientific talk,,,,PK,, asks questions about things they see and touch.
Developmental Milestones,5.11.2.6.1.1,VII.D.1.a,Utilizes Scientific Vocabulary,,,,PK,,Uses simple words to talk about nature and how things work.
Developmental Milestones,5.11.2.6.1.2,VII.D.1.b,Asks and Answers Scientific Questions,,,,PK,, Points to objects and Uses simple words to explore and ask about them.
Developmental Milestones,5.11.2.6.1.3,VII.D.1.c,Interpret Observations Verbally,,,,PK,, Uses words to describe what they see.
Standard,5.11.2.6.2,VII.C.6,Notices effects of weather/seasons on daily life,,,,PK,, Points to or comments on Changes in clothing or activities due to weather.
Developmental Milestones,5.11.2.6.2.1,VII.C.6.a,Identifying Different Weather Conditions,,,,PK,, Points to the sky and names rain or sun.
Developmental Milestones,5.11.2.6.2.2,VII.C.6.b,Understanding Seasonal Changes,,,,PK,," Notices and talks about Changes in the weather, like when it gets colder or leaves change color."
Developmental Milestones,5.11.2.6.2.3,VII.C.6.c,Aligning Clothing to Weather/Seasonal Changes,,,,PK,, Picks clothes that match the weather outside.
Standard,5.11.2.6.3,VII.C.5,Notices and describes changes in weather/seasons,,,,PK,,"- Points to the sky and says, ""Rain!"" when noticing changes in weather."
Developmental Milestones,5.11.2.6.3.1,VII.C.5.a,Identifying Different Weather Conditions,,,,PK,, Points to the sky and names rain or sun.
Developmental Milestones,5.11.2.6.3.2,VII.C.5.b,Recognizing Seasonal Changes,,,,PK,, Notices when the weather gets warmer or colder.
Developmental Milestones,5.11.2.6.3.3,VII.C.5.c,Expressive Language for Weather/Seasonal Descriptions,,,,PK,,"- Names simple weather conditions like ""sunny"" or ""rainy."""
Standard,5.11.2.6.4,VII.C.4,Demonstrates environmental awareness,,,,PK,,Looks around and notices new things in the room.
Developmental Milestones,5.11.2.6.4.1,VII.C.4.a,Recognizes and lists common elements in their environment,,,,PK,,Points to and names familiar objects around them.
Developmental Milestones,5.11.2.6.4.2,VII.C.4.b,Demonstrates understanding of the importance of conservation,,,,PK,,Stacks and unstacks blocks to see which group has more.
Developmental Milestones,5.11.2.6.4.3,VII.C.4.c,Connects actions to environmental consequences,,,,PK,," Notices when their actions cause Changes, like when knocking over a block tower."
Standard,5.11.2.6.5,VII.C.7,Describes temperature,,,,PK,,"- Says ""hot"" or ""cold"" when touching things."
Developmental Milestones,5.11.2.6.5.1,VII.C.7.a,Ability to Sense Temperature,,,,PK,," Notices and reacts to Changes in temperature, like feeling warm or cool."
Developmental Milestones,5.11.2.6.5.2,VII.C.7.b,Understanding Relative Temperature,,,,PK,, Notices when something is hot or cold.
Developmental Milestones,5.11.2.6.5.3,VII.C.7.c,Verbal Expression of Temperature Concepts,,,,PK,,"- Uses words like ""hot"" or ""cold"" to describe how things feel."
Standard,5.11.3,SCI.3,Child compares and categorizes observable phenomena,,,,,,
Label,5.11.3.1,,Infants (INF 0-8) Learning Outcome,,,,,,
Developmental Milestones,5.11.3.1.1,,"Explores objects through touch and mouthing, noticing variations.",,,,,,
Label,5.11.3.2,,Infants (INF 8-18) Learning Outcome,,,,,,
Developmental Milestones,5.11.3.2.1,,Recognizes and points out differences between objects or materials.,,,,,,
Label,5.11.3.3,,Toddler (TOD 18-24) Learning Outcome,,,,,,
Developmental Milestones,5.11.3.3.1,,"Uses basic words to compare phenomena (e.g., “big,” “small”).",,,,,,
Label,5.11.3.4,,Toddler (TOD 24-36) Learning Outcome,,,,,,
Developmental Milestones,5.11.3.4.1,,"Compares objects using descriptive language (e.g., “This is bigger”).",,,,,,
Label,5.11.3.5,,Preschool Learning Outcome (BASE) (36-48) Learning Outcome,,,,,,
Developmental Milestones,5.11.3.5.1,SCI.3.b,"The child is able to differentiate between various objects and phenomena based on their observable characteristics such as size, color, shape, and texture. This skill builds the foundation for making comparisons and distinctions between different phenomena.",,,,,,
Developmental Milestones,5.11.3.5.2,SCI.3.a,"Child sorts objects based on various criteria,",,,,,,
Developmental Milestones,5.11.3.5.3,SCI.3.c,"The child develops the ability to group similar objects and phenomena together based on their common features. They can sort objects into categories, such as animals and plants, or round and square objects.",,,,,,
Developmental Milestones,5.11.3.5.4,SCI.3.d,The child starts to analyze and reason out the differences and similarities of objects and phenomena through keen observation.,,,,,,
Label,5.11.3.6,,PreK Learning Outcomes (2020 Edition) (PreK 48-60) Learning Outcome,,,,,,
Standard,5.11.3.6.1,VII.B.3,Explores and categorizes living things,,,,PK,,Sorts and plays with animals and plants.
Developmental Milestones,5.11.3.6.1.1,VII.B.3.a,Identifies Basic Characteristics of Living Things,,,,PK,,Points to plants or animals and names them.
Developmental Milestones,5.11.3.6.1.2,VII.B.3.b,Groups Living Things Based on Similarities,,,,PK,, Sorts animals or plants that look alike.
Developmental Milestones,5.11.3.6.1.3,VII.B.3.c,Interacts with Living Things in Their Environment,,,,PK,, Watches and Reaches for animals and plants nearby.
Developmental Milestones,5.11.3.6.1.4,VII.B.3.d,"Child observes, investigates, describes, and discusses the characteristics of organisms.",,,,PK,, Notices and talks about different animals and plants.
Standard,5.11.3.6.2,VII.B.1,Distinguishes between living and nonliving,,,,PK,,"- Points to or names animals and plants as ""alive"" and toys or rocks as ""not alive."""
Developmental Milestones,5.11.3.6.2.1,VII.B.1.a,Identification of Characteristics,,,,PK,,Recognizes and points to familiar objects or people.
Developmental Milestones,5.11.3.6.2.2,VII.B.1.b,Categorization Skills,,,,PK,, Sorts toys by color or shape.
Developmental Milestones,5.11.3.6.2.3,VII.B.1.c,Understanding of Lifecycles,,,,PK,, Watches and Notices Changes in plants or animals over time.
Standard,5.11.4,SCI.4,"Child asks a question, gathers information, and makes predictions",,,,,,
Label,5.11.4.1,,Infants (INF 8-18) Learning Outcome,,,,,,
Developmental Milestones,5.11.4.1.1,,Reacts to changes or novel stimuli by turning head or vocalizing.,,,,,,
Label,5.11.4.2,,Infants (INF 0-8) Learning Outcome,,,,,,
Developmental Milestones,5.11.4.2.1,,Explores objects actively to learn more about them.,,,,,,
Label,5.11.4.3,,Toddler (TOD 24-36) Learning Outcome,,,,,,
Developmental Milestones,5.11.4.3.1,,Looks for familiar objects or phenomena during exploration.,,,,,,
Label,5.11.4.4,,Toddler (TOD 18-24) Learning Outcome,,,,,,
Developmental Milestones,5.11.4.4.1,,Gathers information by observing or interacting with phenomena.,,,,,,
Label,5.11.4.5,,Preschool Learning Outcome (BASE) (36-48) Learning Outcome,,,,,,
Developmental Milestones,5.11.4.5.1,SCI.4.a,Can formulate qQuestions,,,,,,
Developmental Milestones,5.11.4.5.2,SCI.4.b,Understands the concept of gathering information to be analyzed later.,,,,,,
Developmental Milestones,5.11.4.5.3,SCI.4.c,Can use the beginnings of predictive reasoning.,,,,,,
Label,5.11.4.6,,PreK Learning Outcomes (2020 Edition) (PreK 48-60) Learning Outcome,,,,,,
Standard,5.11.4.6.1,VII.D.3,Compares and categorizes,,,,PK,,Sorts toys by color or shape.
Developmental Milestones,5.11.4.6.1.1,VII.D.3.a,Identifies Similarities and Differences between objects in the natural world.,,,,PK,, Notices and Points out things that are the same or different in nature.
Developmental Milestones,5.11.4.6.1.2,VII.D.3.b,Grouping and Sorting,,,,PK,, Sort toys by color or shape.
Developmental Milestones,5.11.4.6.1.3,VII.D.3.c,Classifying Objects,,,,PK,, Sorts toys by color or shape.
Standard,5.11.4.6.2,VII.D.2,Uses simple tools for investigating and to make work easier,,,,PK,,Uses a spoon to scoop and eat food.
Developmental Milestones,5.11.4.6.2.1,VII.D.2.a,"Demonstrates proficiency in using basic investigation tools, such as magnifying glasses, rulers or simple software.",,,,PK,,Uses a magnifying glass to look closely at objects.
Developmental Milestones,5.11.4.6.2.2,VII.D.2.b,"Showcases ability to select and utilize appropriate tools to simplify tasks, such as child-safe scissors for cutting or multi-colored markers for organizing information.",,,,PK,, Chooses and Uses tools like safety scissors or markers to complete tasks.
Developmental Milestones,5.11.4.6.2.3,VII.D.2.c,"Exhibits understanding of the concept of tools as aid in different activities, both computer-based and hands-on, like puzzles, interactive games, and basic crafting materials.",,,,PK,, Uses tools like puzzles and games to help with activities.
Standard,5.11.4.6.3,VI.E.2,Collects and organizes data,,,,PK,,Sorts and groups toys by color or shape.
Developmental Milestones,5.11.4.6.3.1,VI.E.2.a,Identifying Data,,,,PK,,Recognizes and points to familiar shapes or objects.
Developmental Milestones,5.11.4.6.3.2,VI.E.2.b,Data Collection,,,,PK,,Collects objects and sorts them by color or shape.
Developmental Milestones,5.11.4.6.3.3,VI.E.2.c,Data Representation,,,,PK,, Points to or Shows objects when asked about them.
Standard,5.11.4.6.4,VII.D.4,Gathers information and makes predictions,,,,PK,,Explores objects and anticipates what happens next.
Developmental Milestones,5.11.4.6.4.1,VII.D.4.a,Information Collection,,,,PK,, Gather things to learn and explore.
Developmental Milestones,5.11.4.6.4.2,VII.D.4.b,Critical Analysis,,,,PK,," Explores and examines objects by looking, touching, and mouthing to understand their features."
Developmental Milestones,5.11.4.6.4.3,VII.D.4.c,Prediction Making,,,,PK,," ""Looks at a toy and guesses where it will roll."""
Standard,5.11.5,SCI.5,Child plans and conducts investigations and experiments,,,,,,
Label,5.11.5.1,,Infants (INF 0-8) Learning Outcome,,,,,,
Developmental Milestones,5.11.5.1.1,,Reaches for or explores objects with curiosity.,,,,,,
Label,5.11.5.2,,Infants (INF 8-18) Learning Outcome,,,,,,
Developmental Milestones,5.11.5.2.1,,"Experiments with actions, such as dropping objects to see what happens.",,,,,,
Label,5.11.5.3,,Toddler (TOD 18-24) Learning Outcome,,,,,,
Developmental Milestones,5.11.5.3.1,,"Participates in guided exploration, like mixing colors or textures",,,,,,
Label,5.11.5.4,,Toddler (TOD 24-36) Learning Outcome,,,,,,
Developmental Milestones,5.11.5.4.1,,"Completes simple experiments, like pouring water to observe movement",,,,,,
Label,5.11.5.5,,Preschool Learning Outcome (BASE) (36-48) Learning Outcome,,,,,,
Developmental Milestones,5.11.5.5.1,SCI.5.a,Child formulates hypotheses or predictions',,,,,,
Developmental Milestones,5.11.5.5.2,SCI.5.b,Child gathers and uses data',,,,,,
Developmental Milestones,5.11.5.5.3,SCI.5.c,Child analyzes results and makes conclusions',,,,,,
Developmental Milestones,5.11.5.5.4,SCI.5.d,Acquire scientific knowledge related to life science (properties of living things).,,,,,,
Developmental Milestones,5.11.5.5.5,SCI.5.e,Acquire scientific knowledge related to earth science (properties of the earth and objects in the sky).,,,,,,
Label,5.11.5.6,,PreK Learning Outcomes (2020 Edition) (PreK 48-60) Learning Outcome,,,,,,
Standard,5.11.5.6.1,VII.C.1,Investigates earth materials,,,,PK,,Plays with sand and rocks.
Developmental Milestones,5.11.5.6.1.1,VII.C.1.a,Identifies Characteristics of Various Earth Materials,,,,PK,, touches and Explores different types of rocks and soils.
Developmental Milestones,5.11.5.6.1.2,VII.C.1.b,Explores Properties of Earth Materials,,,,PK,," touches and Plays with sand, water, and rocks."
Developmental Milestones,5.11.5.6.1.3,VII.C.1.c,Understands Uses of Earth Materials,,,,PK,," Explores rocks, soil, and water by touching and playing with them."
Developmental Milestones,5.11.5.6.1.4,VII.C.1.d,Engage in play to explore the physical and natural world.,,,,PK,, play with objects to discover how things work in the world around them.
Standard,5.11.5.6.2,VII.B.5,Investigates relationship between living things/environment,,,,PK,,Looks closely at plants and animals to see how they interact with their surroundings.
Developmental Milestones,5.11.5.6.2.1,VII.B.5.a,Identification of Living Organisms,,,,PK,, Points to and names animals or plants they recognize.
Developmental Milestones,5.11.5.6.2.2,VII.B.5.b,Understanding Ecosystem Interactions,,,,PK,,Notice how animals and plants live together.
Developmental Milestones,5.11.5.6.2.3,VII.B.5.c,Exploration of Environmental Effects,,,,PK,,- **Discovers** how objects change when touched or moved.
Standard,5.11.5.6.3,VII.A.5,Investigates sources of energy,,,,PK,,Explores how things move or light up.
Developmental Milestones,5.11.5.6.3.1,VII.A.5.a,Identifying Different Types of Energy,,,,PK,," Points to or names different sources of energy, like the sun or a light bulb."
Developmental Milestones,5.11.5.6.3.2,VII.A.5.b,Understanding the Uses of Energy,,,,PK,, Explores how pushing and pulling objects makes them move.
Developmental Milestones,5.11.5.6.3.3,VII.A.5.c,Basic Knowledge of Energy Conservation,,,,PK,, turn off the light when leaving a room.
Standard,5.11.5.6.4,VII.A.2,Investigates properties of materials,,,,PK,, Explores and touches different objects to see what they feel like.
Developmental Milestones,5.11.5.6.4.1,VII.A.2.a,Identifies and Differentiates Materials,,,,PK,,Sorts and picks out different textures or items.
Developmental Milestones,5.11.5.6.4.2,VII.A.2.b,Engages in Experimentation,,,,PK,, Tries out new things to see what happens.
Developmental Milestones,5.11.5.6.4.3,VII.A.2.c,Describes Material Properties,,,,PK,, Points to or touches materials and says what they feel like.
Standard,5.11.5.6.5,VII.B.4,Investigates life cycles,,,,PK,, Watches how a caterpillar turns into a butterfly.
Developmental Milestones,5.11.5.6.5.1,VII.B.4.a,Recognizes the Stages of Life Cycles,,,,PK,, Notices and Points to pictures of baby animals and adult animals.
Developmental Milestones,5.11.5.6.5.2,VII.B.4.b,Tracks Life Cycle Progressions,,,,PK,, Watches and Follows the Changes in plants or animals over time.
Developmental Milestones,5.11.5.6.5.3,VII.B.4.c,Compares Different Life Cycles,,,,PK,, Notices how plants and animals grow and change.
