Item Type,Sequence,Human Code,Full Statement,Abbreviated Statement,Notes,Supp. Info,Ed. Level,Language,Rewritten Statement
Domain,2,ATL,Domain #1: Approaches to Learning,,,,,,
Standard,2.1,ATL.1,Child manages emotions with increasing independence,,,,,,
Label,2.1.1,,Infants (INF 0-8) Learning Outcome,,,,,,
Developmental Milestones,2.1.1.1,,Calms when held by a familiar caregiver,,,,,,
Label,2.1.2,,Infants (INF 8-18) Learning Outcome,,,,,,
Developmental Milestones,2.1.2.1,,Smiles or vocalizes in response to familiar voices.,,,,,,
Label,2.1.3,,Toddler (TOD 18-24) Learning Outcome,,,,,,
Developmental Milestones,2.1.3.1,,"Initiates simple interactions, like holding hands.",,,,,,
Label,2.1.4,,Toddler (TOD 24-36) Learning Outcome,,,,,,
Developmental Milestones,2.1.4.1,,Seeks adults for comfort during challenges,,,,,,
Label,2.1.5,,Preschool Learning Outcome (BASE) (36-48),,,,,,
Developmental Milestones,2.1.5.1,P-ATL.1.a,"""Child can identify and articulate their own emotions.""",,,,,,
Developmental Milestones,2.1.5.2,P-ATL.1.b,"""Child utilizes appropriate coping strategies to handle negative emotions.""",,,,,,
Developmental Milestones,2.1.5.3,P-ATL.1.c,"""Child independently resolves emotional distress or conflict, and can return to play or tasks.""",,,,,,
Label,2.1.6,,PreK Learning Outcomes (2020 Edition) (PreK 48-60) Learning Outcome,,,,,,
Standard,2.1.6.1,I.A.4,Manages emotions,,,,PK,,Shows feelings with facial expressions or sounds.
Developmental Milestones,2.1.6.2,I.A.4.a,Identifies and Names Emotions,,,,PK,,"- Points to pictures and says the emotion word like ""happy"" or ""sad."""
Developmental Milestones,2.1.6.3,I.A.4.b,Expresses Emotions Appropriately,,,,PK,,"Shows feelings with smiles, laughs, or cries."
Developmental Milestones,2.1.6.4,I.A.4.c,Regulates Emotions,,,,PK,, Shows feelings in a calm way.
Standard,2.2,ATL.2,Child follows classroom rules and routines with increasing independence,,,,,,
Label,2.2.1,,Infants (INF 0-8) Learning Outcome,,,,,,
Developmental Milestones,2.2.1.1,,Shows recognition of familiar routines through calmness or anticipation,,,,,,
Label,2.2.2,,Infants (INF 8-18) Learning Outcome,,,,,,
Developmental Milestones,2.2.2.1,,"Participates in simple routines, such as putting toys in a bin when encouraged.",,,,,,
Label,2.2.3,,Toddler (TOD 18-24) Learning Outcome,,,,,,
Developmental Milestones,2.2.3.1,,"Begins anticipating steps in routines, like washing hands before eating.",,,,,,
Label,2.2.4,,Toddler (TOD 24-36) Learning Outcome,,,,,,
Developmental Milestones,2.2.4.1,,"Participates in group routines, such as lining up or cleaning up toys",,,,,,
Label,2.2.5,,Preschool Learning Outcome (BASE) (36-48) Learning Outcome,,,,,,
Developmental Milestones,2.2.5.1,P-ATL.2.a,Understanding and recalling classroom rules,,,,,,
Developmental Milestones,2.2.5.2,P-ATL.2.b,Applying routines independently,,,,,,
Developmental Milestones,2.2.5.3,P-ATL.2.c,Adaptability to changes in rules and routines,,,,,,
Label,2.2.6,,PreK Learning Outcomes (2020 Edition) (PreK 48-60) Learning Outcome,,,,,,
Standard,2.2.6.1,I.A.1,Follows classroom rules,,,,PK,,Listens to simple instructions.
Developmental Milestones,2.2.6.2,I.A.1.a,Recognizes and Understands Classroom Rules,,,,PK,,Follows simple rules during playtime.
Developmental Milestones,2.2.6.3,I.A.1.b,Applies Classroom Rules in Daily Routine,,,,PK,,Follows simple rules during playtime.
Developmental Milestones,2.2.6.4,I.A.1.c,Exhibits Respect for Classroom Rules,,,,PK,,"Follows simple rules, like sharing toys or sitting during story time."
Standard,2.3,ATL.3,Child appropriately handles and takes care of classroom materials,,,,,,
Label,2.3.1,,Infants (INF 0-8) Learning Outcome,,,,,,
Developmental Milestones,2.3.1.1,,Grasps and explores objects with curiosity.,,,,,,
Label,2.3.2,,Infants (INF 8-18) Learning Outcome,,,,,,
Developmental Milestones,2.3.2.1,,Begins to place items in designated spaces with guidance.,,,,,,
Label,2.3.3,,Toddler (TOD 18-24) Learning Outcome,,,,,,
Developmental Milestones,2.3.3.1,,"Helps with simple clean-up tasks, such as putting books back on a shelf.",,,,,,
Label,2.3.4,,Toddler (TOD 24-36) Learning Outcome,,,,,,
Developmental Milestones,2.3.4.1,,Begins to understand the value of taking care of shared materials.,,,,,,
Label,2.3.5,,Preschool Learning Outcome (BASE) (36-48) Learning Outcome,,,,,,
Developmental Milestones,2.3.5.1,P-ATL.3.a,Child demonstrates understanding of rules for using materials,,,,,,
Developmental Milestones,2.3.5.2,P-ATL.3.b,Child actively participates in the cleaning and return of materials,,,,,,
Developmental Milestones,2.3.5.3,P-ATL.3.c,Child displays awareness of classmates' use of materials,,,,,,
Label,2.3.6,,PreK Learning Outcomes (2020 Edition) (PreK 48-60) Learning Outcome,,,,,,
Standard,2.3.6.1,I.A.2,Takes care of classroom materials,,,,PK,,Puts toys back on the shelf after playing.
Developmental Milestones,2.3.6.2,I.A.2.a,Demonstrates Responsibility,,,,PK,,Helps clean up toys after playtime.
Developmental Milestones,2.3.6.3,I.A.2.b,Follows Usage Guidelines,,,,PK,,Uses objects or toys as intended during play.
Developmental Milestones,2.3.6.4,I.A.2.c,Engages in Clean-Up Activities,,,,PK,,Helps put toys away.
Standard,2.4,ATL.4,"Child manages actions, words, and behavior with increasing independence",,,,,,
Label,2.4.1,,Infants (INF 0-8) Learning Outcome,,,,,,
Developmental Milestones,2.4.1.1,,Reacts to caregiver’s facial expressions and calming voice,,,,,,
Label,2.4.2,,Toddler (TOD 18-24) Learning Outcome,,,,,,
Developmental Milestones,2.4.2.1,,Begins to stop or start actions based on simple verbal cues.,,,,,,
Label,2.4.3,,Toddler (TOD 24-36) Learning Outcome,,,,,,
Developmental Milestones,2.4.3.1,,"Uses simple words to express needs or feelings instead of actions (e.g., “Mine!”).",,,,,,
Label,2.4.4,,Infants (INF 8-18) Learning Outcome,,,,,,
Developmental Milestones,2.4.4.1,,Demonstrates self-control during transitions and group activities.,,,,,,
Label,2.4.5,,Preschool Learning Outcome (BASE) (36-48) Learning Outcome,,,,,,
Developmental Milestones,2.4.5.1,P-ATL.4.a,Child can complete age-appropriate tasks with little to no assistance (Self-sufficiency).,,,,,,
Developmental Milestones,2.4.5.2,P-ATL.4.b,Child demonstrates control over emotions and can communicate feelings appropriately (Emotional regulation and communication).,,,,,,
Developmental Milestones,2.4.5.3,P-ATL.4.c,"Child follows rules and instructions, showing an understanding of appropriate behavior (Understanding and adherence to rules).",,,,,,
Label,2.4.6,,PreK Learning Outcomes (2020 Edition) (PreK 48-60) Learning Outcome,,,,,,
Standard,2.4.6.1,I.A.3,Regulates own behavior,,,,PK,, Waits patiently when asked.
Developmental Milestones,2.4.6.2,I.A.3.b,Follows Rules and Routines,,,,PK,,Listens and follows simple instructions.
Developmental Milestones,2.4.6.3,I.A.3.a,Demonstrates Self-Control,,,,PK,,Stops and waits when asked.
Standard,2.5,ATL.5,Child demonstrates an increasing ability to control impulses,,,,,,
Label,2.5.1,,Infants (INF 8-18) Learning Outcome,,,,,,
Developmental Milestones,2.5.1.1,,Waits briefly when attention is redirected.,,,,,,
Label,2.5.2,,Infants (INF 0-8) Learning Outcome,,,,,,
Developmental Milestones,2.5.2.1,,Pauses actions when a caregiver says “no” or redirects.,,,,,,
Label,2.5.3,,Toddler (TOD 18-24) Learning Outcome,,,,,,
Developmental Milestones,2.5.3.1,,"Attempts self-control with gestures or words (e.g., waiting before grabbing a toy).",,,,,,
Label,2.5.4,,Toddler (TOD 24-36) Learning Outcome,,,,,,
Developmental Milestones,2.5.4.1,,"Controls impulses with guidance, such as refraining from interrupting.",,,,,,
Label,2.5.5,,Preschool Learning Outcome (BASE) (36-48) Learning Outcome,,,,,,
Developmental Milestones,2.5.5.1,P-ATL.5.a,Child shows improvement in delaying immediate gratification for a bigger reward.,,,,,,
Developmental Milestones,2.5.5.2,P-ATL.5.b,"Child increasingly adheres to set rules and boundaries, demonstrating enhanced self-discipline.",,,,,,
Developmental Milestones,2.5.5.3,P-ATL.5.c,Child often utilizes problem-solving strategies instead of acting on initial impulses.,,,,,,
Label,2.5.6,,PreK Learning Outcomes (2020 Edition) (PreK 48-60) Learning Outcome,,,,,,
Standard,2.5.6.1,I.B.1,Controls impulses,,,,PK,, Waits for a turn during play.
Developmental Milestones,2.5.6.2,I.B.1.b,Follows Instructions,,,,PK,, Listens and does what you ask.
Developmental Milestones,2.5.6.3,I.B.1.a,Practices Patience,,,,PK,, Waits calmly for their turn.
Developmental Milestones,2.5.6.4,I.B.1.c,Manages Emotions,,,,PK,," Shows feelings by smiling, crying, or laughing."
Standard,2.6,ATL.6,Child maintains focus and sustains attention with minimal adult support,,,,,,
Label,2.6.1,,Infants (INF 0-8) Learning Outcome,,,,,,
Developmental Milestones,2.6.1.1,,Watches moving objects or faces for short periods.,,,,,,
Label,2.6.2,,Infants (INF 8-18) Learning Outcome,,,,,,
Developmental Milestones,2.6.2.1,,"Focuses on activities, such as stacking blocks, for increasing durations.Engages with a single activity for a few minutes before seeking adult interaction.",,,,,,
Label,2.6.3,,Toddler (TOD 18-24) Learning Outcome,,,,,,
Developmental Milestones,2.6.3.1,,"Resumes tasks after mild distractions, such as looking back at a toy after hearing a noise.",,,,,,
Label,2.6.4,,Toddler (TOD 24-36) Learning Outcome,,,,,,
Developmental Milestones,2.6.4.1,,"Completes multi-step tasks with reminders (e.g., “Pick up the block and put it in the bin”).",,,,,,
Label,2.6.5,,Preschool Learning Outcome (BASE) (36-48) Learning Outcome,,,,,,
Developmental Milestones,2.6.5.1,P-ATL.6.a,Child engages with a single activity for an extended period (5-10 minutes) without frequent redirection.,,,,,,
Developmental Milestones,2.6.5.2,P-ATL.6.b,Child follows simple instructions and completes short tasks with minimal reminders from adults.,,,,,,
Developmental Milestones,2.6.5.3,P-ATL.6.c,Child shows interest and curiosity by asking questions and exploring materials independently.,,,,,,
Label,2.6.6,,PreK Learning Outcomes (2020 Edition) (PreK 48-60) Learning Outcome,,,,,,
Standard,2.6.6.1,I.B.3,Maintains focus (group activity),,,,PK,, Watches and Listens during group play.
Developmental Milestones,2.6.6.2,I.B.3.a,Sustains Attention,,,,PK,, Focuses on a toy or activity for a few minutes.
Developmental Milestones,2.6.6.3,I.B.3.b,Participates Cooperatively,,,,PK,,Shares toys during play.
Developmental Milestones,2.6.6.4,I.B.3.c,Resists Distraction,,,,PK,,- Stays focused on a toy or activity even when there's noise around.
Standard,2.7,ATL.7,Child persists in tasks,,,,,,
Label,2.7.1,,Infants (INF 0-8) Learning Outcome,,,,,,
Developmental Milestones,2.7.1.1,,"Attempts to grasp objects or roll over, even after initial failure.",,,,,,
Label,2.7.2,,Infants (INF 8-18) Learning Outcome,,,,,,
Developmental Milestones,2.7.2.1,,Seeks adult assistance if unable to complete a task independently.,,,,,,
Label,2.7.3,,Toddler (TOD 18-24) Learning Outcome,,,,,,
Developmental Milestones,2.7.3.1,,"Tries multiple approaches to solve problems, such as stacking blocks after a tower falls.",,,,,,
Label,2.7.4,,Toddler (TOD 24-36) Learning Outcome,,,,,,
Developmental Milestones,2.7.4.1,,Uses trial-and-error methods without giving up quickly.,,,,,,
Label,2.7.5,,Preschool Learning Outcome (BASE) (36-48) Learning Outcome,,,,,,
Developmental Milestones,2.7.5.1,P-ATL.7.a,Developing focus,,,,,,
Developmental Milestones,2.7.5.2,P-ATL.7.b,Demonstrating adaptive skills,,,,,,
Developmental Milestones,2.7.5.3,P-ATL.7.c,Exhibiting perseverance,,,,,,
Label,2.7.6,,PreK Learning Outcomes (2020 Edition) (PreK 48-60) Learning Outcome,,,,,,
Standard,2.7.6.1,I.B.2,Persists in task (individual),,,,PK,,Keeps trying to stack blocks even if they fall.
Developmental Milestones,2.7.6.2,I.B.2.a,Maintains Focus,,,,PK,, Looks at a toy or person for a few moments without getting distracted.
Developmental Milestones,2.7.6.3,I.B.2.b,Exhibits Determination,,,,PK,, Tries again and again to reach a toy.
Developmental Milestones,2.7.6.4,I.B.2.c,Shows Task Completion,,,,PK,, Finishes simple activities or games.
Developmental Milestones,2.7.6.5,I.B.2.d,Child shows understanding by following three-step verbal directions.,,,,PK,, Follows three simple steps when asked.
Standard,2.8,ATL.8,Child holds information in mind and manipulates it to perform tasks,,,,,,
Label,2.8.1,,Infants (INF 8-18) Learning Outcome,,,,,,
Developmental Milestones,2.8.1.1,,Searches for partially hidden objects during play.,,,,,,
Label,2.8.2,,Infants (INF 0-8) Learning Outcome,,,,,,
Developmental Milestones,2.8.2.1,,"Completes simple cause-and-effect tasks based on past experiences (e.g., pressing a button to hear a sound).",,,,,,
Label,2.8.3,,Toddler (TOD 18-24) Learning Outcome,,,,,,
Developmental Milestones,2.8.3.1,,"Completes familiar sequences, like stacking blocks in order, using memory.",,,,,,
Label,2.8.4,,Toddler (TOD 24-36) Learning Outcome,,,,,,
Developmental Milestones,2.8.4.1,,Recalls and follows multi-step instructions with guidance.,,,,,,
Label,2.8.5,,Preschool Learning Outcome (BASE) (36-48) Learning Outcome,,,,,,
Developmental Milestones,2.8.5.1,P-ATL.8.b,Child shows evidence of Cognitive Flexibility,,,,,,
Developmental Milestones,2.8.5.2,P-ATL.8.c,Task Execution is observed informally or formally.,,,,,,
Developmental Milestones,2.8.5.3,P-ATL.8.a,Child shows evidence of Memory Retention,,,,,,
Label,2.8.6,,PreK Learning Outcomes (2020 Edition) (PreK 48-60) Learning Outcome,,,,,,
Standard,2.8.6.1,I.B.4,Retains and recalls information,,,,PK,, Remembers and repeats familiar actions or words.
Developmental Milestones,2.8.6.2,I.B.4.a,Short-term Memory Proficiency,,,,PK,,- **Remember favorite toys and look for them when they are out of sight.**
Developmental Milestones,2.8.6.3,I.B.4.b,Long-term Memory Consolidation,,,,PK,, Remembers familiar faces and toys after a short absence.
Developmental Milestones,2.8.6.4,I.B.4.c,Information Processing and Recall,,,,PK,, Remembers and recognizes familiar faces and objects.
Standard,2.9,ATL.9,Child demonstrates flexibility in thinking and behavior,,,,,,
Label,2.9.1,,Infants (INF 0-8) Learning Outcome,,,,,,
Developmental Milestones,2.9.1.1,,"Reacts differently to new stimuli, showing curiosity or caution.",,,,,,
Label,2.9.2,,Toddler (TOD 24-36) Learning Outcome,,,,,,
Developmental Milestones,2.9.2.1,,"Tries different methods to achieve goals, like turning an object to make it fit.",,,,,,
Label,2.9.3,,Toddler (TOD 18-24) Learning Outcome,,,,,,
Developmental Milestones,2.9.3.1,,Adapts to changes in routines with support.,,,,,,
Label,2.9.4,,Infants (INF 8-18) Learning Outcome,,,,,,
Developmental Milestones,2.9.4.1,,Uses alternate strategies when a preferred method does not work.,,,,,,
Label,2.9.5,,Preschool Learning Outcome (BASE) (36-48) Learning Outcome,,,,,,
Developmental Milestones,2.9.5.1,P-ATL.9.a,"""Child exhibits adaptability in new situations or changes in routine""",,,,,,
Developmental Milestones,2.9.5.2,P-ATL.9.b,"""Child shows capability in problem-solving using different strategies""",,,,,,
Developmental Milestones,2.9.5.3,P-ATL.9.c,"""Child portrays an understanding and acceptance of different perspectives and ideas""",,,,,,
Label,2.9.6,,PreK Learning Outcomes (2020 Edition) (PreK 48-60) Learning Outcome,,,,,,
Standard,2.9.6.1,I.B.5,Demonstrates flexible thinking and behavior,,,,PK,, Tries new ways to solve a problem or play with toys.
Developmental Milestones,2.9.6.2,I.B.5.a,Displays Cognitive Adaptability,,,,PK,, Tries new ways to solve simple problems.
Developmental Milestones,2.9.6.3,I.B.5.b,Exhibits Behavioral Flexibility,,,,PK,,Shows ability to adapt to changes in routine.
Developmental Milestones,2.9.6.4,I.B.5.c,Demonstrates Problem-solving Ability,,,,PK,,Figures out how to reach a toy that's out of reach.
Standard,2.1,ATL.10,Child demonstrates initiative and independence,,,,,,
Label,2.10.1,,Infants (INF 8-18) Learning Outcome,,,,,,
Developmental Milestones,2.10.1.1,,Reaches for objects or moves toward items of interest.,,,,,,
Label,2.10.2,,Infants (INF 0-8) Learning Outcome,,,,,,
Developmental Milestones,2.10.2.1,,Explores toys and new environments with curiosity,,,,,,
Label,2.10.3,,Toddler (TOD 18-24) Learning Outcome,,,,,,
Developmental Milestones,2.10.3.1,,"Initiates simple actions, such as setting up toys for play.",,,,,,
Label,2.10.4,,Toddler (TOD 24-36) Learning Outcome,,,,,,
Developmental Milestones,2.10.4.1,,"Takes responsibility for small tasks, like putting toys away.",,,,,,
Label,2.10.5,,Preschool Learning Outcome (BASE) (36-48) Learning Outcome,,,,,,
Developmental Milestones,2.10.5.1,P-ATL.10.a,Child exhibits self-direction in play and learning activities.,,,,,,
Developmental Milestones,2.10.5.2,P-ATL.10.b,Child independently completes tasks with minimal assistance.,,,,,,
Developmental Milestones,2.10.5.3,P-ATL.10.c,Child shows curiosity and willingness to explore and try new activities.,,,,,,
Label,2.10.6,,PreK Learning Outcomes (2020 Edition) (PreK 48-60) Learning Outcome,,,,,,
Standard,2.10.6.1,I.C.1,Demonstrates independence and initiative,,,,PK,, Tries new activities without help.
Developmental Milestones,2.10.6.2,I.C.1.a,Exhibits Self-Reliance,,,,PK,, Takes small steps to do things independently.
Developmental Milestones,2.10.6.3,I.C.1.b,Shows Confidence in Decision-making,,,,PK,, Chooses toys or activities independently.
Developmental Milestones,2.10.6.4,I.C.1.c,Displays Proactive Behaviour,,,,PK,, Reaches out to explore new toys or objects.
Standard,2.11,ATL.11,Child shows interest in and curiosity about the world around them,,,,,,
Label,2.11.1,,Infants (INF 0-8) Learning Outcome,,,,,,
Developmental Milestones,2.11.1.1,,"Explores surroundings by watching, grasping, or mouthing objects.",,,,,,
Label,2.11.2,,Infants (INF 8-18) Learning Outcome,,,,,,
Developmental Milestones,2.11.2.1,,Shows curiosity by pointing at or reaching for new objects,,,,,,
Label,2.11.3,,Toddler (TOD 18-24) Learning Outcome,,,,,,
Developmental Milestones,2.11.3.1,,"Investigates new objects or environments (e.g., opening drawers, lifting lids).",,,,,,
Label,2.11.4,,Toddler (TOD 24-36) Learning Outcome,,,,,,
Developmental Milestones,2.11.4.1,,"Demonstrates curiosity by asking specific questions (e.g., “What’s that sound?”).",,,,,,
Label,2.11.5,,Preschool Learning Outcome (BASE) (36-48) Learning Outcome,,,,,,
Developmental Milestones,2.11.5.1,P-ATL.11.a,Child engages with their environment,,,,,,
Developmental Milestones,2.11.5.2,P-ATL.11.b,Child asks questions about unfamiliar things,,,,,,
Developmental Milestones,2.11.5.3,P-ATL.11.c,Child exhibits exploratory behavior,,,,,,
Label,2.11.6,,PreK Learning Outcomes (2020 Edition) (PreK 48-60) Learning Outcome,,,,,,
Standard,2.11.6.1,I.C.2,Displays curiosity,,,,PK,, Explores new objects by touching or looking at them.
Developmental Milestones,2.11.6.2,I.C.2.a,Asks Questions on topics of interest,,,,PK,,"- Points and asks ""What's that?"" when curious."
Developmental Milestones,2.11.6.3,I.C.2.b,'Experiments with Objects',,,,PK,," ""Plays with toys to see what they can do."""
Developmental Milestones,2.11.6.4,I.C.2.c,'Shows Interest in Own Learning',,,,PK,, Explores new toys and activities with curiosity.
Standard,2.12,ATL.12,Child expresses creativity in thinking and communication,,,,,,
Label,2.12.1,,Infants (INF 0-8) Learning Outcome,,,,,,
Developmental Milestones,2.12.1.1,,"Reacts to varied stimuli, such as music or bright colors, with smiles or coos.",,,,,,
Label,2.12.2,,Infants (INF 8-18) Learning Outcome,,,,,,
Developmental Milestones,2.12.2.1,,Experiments with sounds or babbling to imitate words or melodies.,,,,,,
Label,2.12.3,,Toddler (TOD 18-24) Learning Outcome,,,,,,
Developmental Milestones,2.12.3.1,,"Combines words, gestures, or objects creatively (e.g., using a block as a phone).",,,,,,
Label,2.12.4,,Toddler (TOD 24-36) Learning Outcome,,,,,,
Developmental Milestones,2.12.4.1,,"Creates imaginative scenarios during play (e.g., “I’m a firefighter!”).",,,,,,
Label,2.12.5,,Preschool Learning Outcome (BASE) (36-48) Learning Outcome,,,,,,
Developmental Milestones,2.12.5.1,P-ATL.12.a,Child uses imaginative thinking to create new ideas or interpretations.',,,,,,
Developmental Milestones,2.12.5.2,P-ATL.12.b,"Child conveys ideas and emotions through various forms of art, drama, and play.'",,,,,,
Developmental Milestones,2.12.5.3,P-ATL.12.c,Child engages in storytelling or description to express thoughts and experiences.',,,,,,
Label,2.12.6,,PreK Learning Outcomes (2020 Edition) (PreK 48-60) Learning Outcome,,,,,,
Standard,2.12.6.1,I.D.2,Exhibits creativity in thinking,,,,PK,, Creates new ways to play with toys or everyday objects.
Developmental Milestones,2.12.6.2,I.D.2.a,"""Demonstrates ability to think of multiple solutions to a problem""",,,,PK,, Tries different ways to solve a problem.
Developmental Milestones,2.12.6.3,I.D.2.b,"""Applies imaginative thought in craftwork or storytelling""",,,,PK,, Pretends with toys or makes up simple stories.
Developmental Milestones,2.12.6.4,I.D.2.c,"""Shows ability to approach familiar tasks in new and innovative ways""",,,,PK,, Tries new ways to play with familiar toys.
Standard,2.13,ATL.13,Child uses imagination in play and interaction with others,,,,,,
Label,2.13.1,,Infants (INF 8-18) Learning Outcome,,,,,,
Developmental Milestones,2.13.1.1,,"Reacts to playful activities, such as peek-a-boo or silly voices, with smiles or laughter.",,,,,,
Label,2.13.2,,Infants (INF 0-8) Learning Outcome,,,,,,
Developmental Milestones,2.13.2.1,,"Engages in simple imitative play (e.g., pretending to talk on a phone).",,,,,,
Label,2.13.3,,Toddler (TOD 18-24) Learning Outcome,,,,,,
Developmental Milestones,2.13.3.1,,"Engages in basic role-play, such as pretending to be a parent or an animal.",,,,,,
Label,2.13.4,,Toddler (TOD 24-36) Learning Outcome,,,,,,
Developmental Milestones,2.13.4.1,,"Creates extended pretend play sequences (e.g., cooking food and serving it to peers).",,,,,,
Label,2.13.5,,Preschool Learning Outcome (BASE) (36-48) Learning Outcome,,,,,,
Developmental Milestones,2.13.5.1,P-ATL.13.a,"""Child exhibits creative role-playing during playtime""",,,,,,
Developmental Milestones,2.13.5.2,P-ATL.13.b,"""Child incorporates invented scenarios in social interactions""",,,,,,
Developmental Milestones,2.13.5.3,P-ATL.13.c,"""Child applies inventive use of toys and props in play and interaction""",,,,,,
Developmental Milestones,2.13.5.4,P-ATL.13.d,Play beside other children and imitate the play of another child.,,,,,,
Label,2.13.6,,PreK Learning Outcomes (2020 Edition) (PreK 48-60) Learning Outcome,,,,,,
Standard,2.13.6.1,I.D.1,Uses imagination in play,,,,PK,,"Pretends objects are something else, like using a block as a phone."
Developmental Milestones,2.13.6.2,I.D.1.a,Showcases Creativity in Art & Crafts,,,,PK,, Paints with fingers to create colorful pictures.
Developmental Milestones,2.13.6.3,I.D.1.b,Engages in Pretend Play,,,,PK,, Pretends to feed a doll or stuffed animal.
Developmental Milestones,2.13.6.4,I.D.1.c,Develops Storytelling Abilities,,,,PK,, Tells simple stories using words or gestures.
Domain,3,SE,Domain #2: Social and Emotional Development,,,,,,
Standard,3.1,SE.1,Child engages in and maintains positive relationships and interactions with adults,,,,,,
Label,3.1.1,,Infants (INF 0-8) Learning Outcome,,,,,,
Developmental Milestones,3.1.1.1,,Smiles or vocalizes in response to familiar voices.,,,,,,
Label,3.1.2,,Infants (INF 8-18) Learning Outcome,,,,,,
Developmental Milestones,3.1.2.1,,Calms when held by a familiar caregiver.,,,,,,
Label,3.1.3,,Toddler (TOD 18-24) Learning Outcome,,,,,,
Developmental Milestones,3.1.3.1,,"Initiates simple interactions, like holding hands.",,,,,,
Label,3.1.4,,Toddler (TOD 24-36) Learning Outcome,,,,,,
Developmental Milestones,3.1.4.1,,Seeks adults for comfort during challenges,,,,,,
Label,3.1.5,,Preschool Learning Outcome (BASE) (36-48) Learning Outcome,,,,,,
Developmental Milestones,3.1.5.1,P-SE.1.a,Child shows respect and responsive behavior towards adults.,,,,,,
Developmental Milestones,3.1.5.2,P-SE.1.b,Child can build trusted relationships with adult figures.,,,,,,
Developmental Milestones,3.1.5.3,P-SE.1.c,Child exhibits effective communication skills with adults.,,,,,,
Label,3.1.6,,PreK Learning Outcomes (2020 Edition) (PreK 48-60) Learning Outcome,,,,,,
Standard,3.1.6.1,II.C.1,Communicates to build relationships,,,,PK,,Uses sounds or gestures to connect with others.
Developmental Milestones,3.1.6.2,II.C.1.a,Verbal Expression,,,,PK,,"- Says simple words like ""mama"" or ""dada."""
Developmental Milestones,3.1.6.3,II.C.1.b,Active Listening,,,,PK,, Listens and responds to familiar voices or sounds.
Developmental Milestones,3.1.6.4,II.C.1.c,Emotional Intelligence,,,,PK,,"Shows feelings by smiling, frowning, or crying."
Standard,3.1.6.5,II.C.2,Interacts positively with adults,,,,PK,, Smiles or Reaches out to familiar adults.
Developmental Milestones,3.1.6.6,II.C.2.a,Demonstrates respectful behavior towards adults.,,,,PK,, Shows kindness to grown-ups by sharing toys or giving smiles.
Developmental Milestones,3.1.6.7,II.C.2.b,Communicates effectively and expresses needs or feelings to adults.,,,,PK,," Uses gestures, sounds, or simple words to show needs or feelings to adults."
Developmental Milestones,3.1.6.8,II.C.2.c,Shows active listening and responds appropriately when adults speak.,,,,PK,, Looks at adults and Smiles or babbles back when they talk.
Standard,3.2,SE.2,Child engages in prosocial and cooperative behavior with adults,,,,,,
Label,3.2.1,,Infants (INF 0-8) Learning Outcome,,,,,,
Developmental Milestones,3.2.1.1,,Reacts to soothing voices by calming or smiling,,,,,,
